sentence,label,idx
còn hơi thiếu sinh động .,0,8277
kiến thức truyền đạt tốt .,2,8278
"đúng giờ , nhiều tài liệu tham khảo .",2,8279
"giảng viên bám sát hơn nội dung môn học , tránh đi lan man .",0,8280
code demo hơi khó hiểu .,0,8281
nên giải thích một số vấn đề khó chi tiết hơn .,0,8282
"giảng dạy hiệu quả , đi dạy đúng giờ .",2,8283
chưa truyền đạt cho rõ .,0,8284
"giảng viên lên lớp đúng giờ , các buổi bù đều hợp lý , giảng bài nghiêm túc , có kiểm tra quá trình , bài tập về nhà .",2,8285
nói bình bình thì không thể nhớ được .,0,8286
"tài liệu nên được biên soạn tốt hơn vì những slide của thầy có nhiều câu giống như dùng google dịch rồi copy qua vậy , trong slide cũng có nhiều chỗ sai sót , khi dạy thì thầy mới phát hiện sai .",0,8287
"thầy dạy được , vui vẻ .",2,8288
tôi nghĩ thầy là một người tốt và thân thiện .,2,8289
"ân cần , quan tâm , nhiệt tình , hết lòng trong giảng dạy .",2,8290
"máy tính của phòng thực hành không đáp ứng được nhu cầu môn học , giảng viên yêu cầu tự làm trên laptop và mang lên phòng thực hành chấm điểm , vậy phòng thực hành là phòng chấm điểm ?",0,8291
giảng bài chuyên sâu .,2,8292
cần nêu rõ mối liên hệ giữa môn này với chuyên ngành đang theo học .,0,8293
"giảng viên truyền đạt tốt , chỉ bảo tận tình .",2,8294
"thầy vui tính , dễ hiểu .",2,8295
slide bài giảng nên sử dụng hoàn toàn bằng tiếng anh thay vì sử dụng nửa việt nửa anh như hiện nay để tránh gây khó hiểu cho sinh viên .,0,8296
"đề cương khó hiểu , không có tài liệu tham khảo kể cả tài liệu nước ngoài .",0,8297
em không học được bất kỳ kiến thức gì ở môn này .,0,8298
các hoạt động thi đua các nhóm trên lớp với nhau .,1,8299
không quan tâm tới sinh viên khi làm thực hành .,0,8300
nhận lương thì phải làm tốt bổn phận của một người thầy chứ ạ .,0,8301
cô không tạo được không khí chủ động trong lớp .,0,8302
"thầy wzjwz105 giảng dạy rất tốt , truyền đạt hay , luôn đưa ra những vấn đề hay .",2,8303
cơ mà sao phân biệt thầy với thầy wzjwz294 vậy thầy ?,0,8304
"giảng viên nhiệt tình trong quá trình giảng dạy và trả lời câu hỏi cho sinh viên , giảng viên khá vui tính .",2,8305
"nội dung thực hành còn khá nhẹ , tôi muốn nó nhiều và khó hơn để được nghiên cứu nhiều khía cạnh hơn của môn học .",0,8306
phân bố lại chương trình vì bài khá dài .,0,8307
không có y kiến .,1,8308
thực sự môn này chiếm 85% thời gian học mà trong khi đó bài báo cáo chỉ chiếm 15% trong tổng số điểm .,0,8309
phòng học nóng .,0,8310
"cô rất nhiệt tình giải đáp thắc mắc , cô dành thời gian giải đáp thắc mắc của sinh viên .",2,8311
học nhóm .,1,8312
cần có các ví dụ minh họa thực tế bên ngoài nhiều hơn .,0,8313
phong cách dạy hiệu quả .,2,8314
"giảng viên nên nghiêm túc hơn , cứ đùa đùa sao ấy .",0,8315
cho bài tập hay và nhiều .,2,8316
nên có nhiều bài tập hơn !,0,8317
phương pháp dạy giúp thoải mái ( kể chuyện ) .,2,8318
phòng học nóng quá nên lắp thêm quạt .,0,8319
"thứ nhất thầy không đảm bảo được giờ lên lớp , rất khó khăn để báo cáo đồ án và hỏi ý kiến thầy .",0,8320
chương trình dạy hơi nhiều .,0,8321
đề nghị đề thi cần phân ra mức độ dễ khó dễ rõ ràng hơn .,0,8322
cần có nhiều trò chơi vận động hấp dẫn .,0,8323
môn này nên kết hợp lồng ghép với môn thực hành điện điện tử môn này đã học trong học kỳ 5 .,0,8324
"thầy rất tận tâm trong giảng dạy , sử dụng các thiết bị phục vụ bài giảng rất hiệu quả , định hướng các công việc cụ thể cho sinh viên trong tương lai , tạo tâm lý tự tin , thoải mái , truyền cảm hứng cho sinh viên .",2,8325
"môn này là một môn liên hệ nhiều với thực tiễn nên mong thầy có nhiều ví dụ thực tiễn hơn , làm cho việc học dễ hiểu hơn .",0,8326
"giáo viên dạy tận tâm , dễ hiễu .",2,8327
"rất hài lòng về cô , cô rất nhiệt tình .",2,8328
"vui vẻ , kiến thức rộng và sâu , dạy dễ hiểu .",2,8329
"vừa đọc slide vừa giảng , dễ gây buồn ngủ và hơi khó hiểu .",0,8330
thái độ xem thường sinh viên khi báo cáo .,0,8331
"giảng viên đảm bảo giờ lên lớp , tập trung vô việc dạy học .",2,8332
"nếu có thì nên mở lớp nâng cao web , như xử lý truy cập lớn , phân bố cơ sở dữ liệu có ích cho việc ra làm hơn .",0,8333
"giảng viên rất nhiệt tình , phương pháp giảng dạy hay , dễ hiểu .",2,8334
nên lồng ghép các trò chơi nhỏ vào buổi học để tăng hứng thú cho sinh viên .,0,8335
"thầy dạy dễ hiểu , thân thiện , lưu ý cho sinh viên những lỗi thường sai khi làm kiển tra và gợi ý mẹo làm bài tốt .",2,8336
thầy hay tương tác với sinh viên bằng những câu hỏi rất thực tế !,2,8337
"nhưng thầy phụ trách bộ môn lại hay vắng đột xuất , đổi thời gian dạy liên tục nằm ngoài thời khóa biểu làm em không thể nào sắp xếp thời gian nắm bắt tình hình học tập ( mặt dù có lần thông báo trước , có lần đột xuất không thông báo ) .",0,8338
những câu chuyện thầy kể do thầy trải qua làm em rất thích .,2,8339
"thầy dạy tận tình , luôn giải đáp mọi thắc mắc của sinh viên , thầy cũng vui tính .",2,8340
tiết học vui vẻ .,2,8341
"hướng dẫn tận tình , cho ví dụ minh họa hay .",2,8342
"cô giảng dạy rất có tâm với nghề , đôi khi cô còn cho tụi em thêm bài tập tự luyện .",2,8343
em muốn được hiểu rõ những ứng dụng của môn học này vào ngành học mà chúng ta đang học là gì .,0,8344
thầy thân thiện và nhiệt tình .,2,8345
sửa và cho các bài tập rõ ràng hơn !,0,8346
"thầy dạy không nhiệt tình , ít giảng , kiến thức chuyên môn logic mờ chưa chuyên sâu , gây tâm lý lo lắng , hoang mang cho sinh viên .",0,8347
thầy có đưa tư tưởng không tốt vào trong tiết học .,0,8348
"cô hướng dẫn sinh viên và nhận xét về đồ án rất tận tình , chính xác .",2,8349
giọng to rõ ràng dễ nghe khi ở dưới nước .,2,8350
"hơi khó hiểu và giảng bài nhanh , ít đưa ra ví dụ cụ thể cho mỗi kiến thức .",0,8351
hăng say đến nỗi quên cả giờ giấc .,2,8352
cần rèn luyện thêm kỹ năng làm bài thi hơn cho sinh viên nên thường xuyên giải các đề và làm nhiều bài tập liên quan đến ngữ pháp hơn .,0,8353
sau mỗi bài thực hành nộp deadline thầy không sửa bài .,0,8354
không cung cấp kiến thức cho sinh viên .,0,8355
"cung cấp phương pháp học tập hiệu quả , thân thiện , vui vẻ với sinh viên .",2,8356
"giảng viên hướng dẫn nhiệt tình , trả lời thắc mắc kịp thời .",2,8357
thầy rất dễ tính trong giờ học .,2,8358
"dưới góc nhìn một sinh viên , tôi thấy chuyên môn của cô thật tuyệt vời !",2,8359
"thầy giảng bài rất hay , lấy ví dụng sinh động , thực tiễn .",2,8360
"thầy khá tận tâm , nhiệt tình với sinh viên .",2,8361
"không áp dụng vào đời sống nhiều , phân chia thời gian học chưa hợp lý .",0,8362
"giang viên giảng dạy nhiệt tình , dễ hiểu .",2,8363
"máy chiếu thì quá mờ mới gần đây thôi , quạt thì có cái chạy được , có cái bị hỏng công tắc .",0,8364
"giảng nhiều , dễ hiểu , truyền đạt có hệ thống .",2,8365
không có sự lôi cuốn và thu hút trong cách giảng .,0,8366
"thầy nhiệt tình vui tính , dạy dễ hiểu .",2,8367
mong cô nếu giao đồ án thì nên cho học sinh tìm hiểu trước về ứng dụng mfc từ đầu kỳ .,0,8368
"thầy có cách làm đồ án là quay video clip rất hay , vừa vui vừa là cách tìm hiểu kiến thức một cách mới , hứng thú .",2,8369
cung cấp slide trước để sinh viên có tư liệu tìm hiểu trước ở nhà .,2,8370
phương pháp dạy chưa hợp lý .,0,8371
"thầy vui tính , giảng hay , nhiệt huyết với các bạn .",2,8372
"tận tâm với sinh viên , vui vẻ trong giờ học .",2,8373
"máy của phòng thực hành wzjwz241 khởi động visual studio chậm , bàn phím chưa tốt .",0,8374
"môn học rất bổ ích , tuy là lý thuyết rất nhiều , nhưng trong những chương giảng dạy cũng nên có một vài bài tập đơn giảng để vận dụng bài tập vào thực tiễn và thông qua bài tập đó có thể rút ra kinh nghiệm làm việc .",0,8375
"nhiệt tình , giáo án tốt , có nhiều bài tập vận dụng trên website môn học .",2,8376
"thầy nhiệt tình giúp đỡ , tận tâm với công việc .",2,8377
em đề nghị trường mình nên áp dung hình thức thực hành động .,0,8378
"không phải là tôi chưa từng rớt môn , nhưng tôi không phục và không cam tâm đối với trường hợp của 2 bạn kia có cùng source code , nếu thầy hỏi 2 bạn kia từng đoạn code giống như thầy đã hỏi tôi thì chắc gì 2 bạn đó trả lời được , vì code cũng đều lấy từ internet về và có phải 2 bạn đó code đâu .",0,8379
cần quan tâm nhiều hơn về vấn đề bài tập .,0,8380
"nhiệt tình , dễ gần .",2,8381
"phòng học gần công trình đang xây dựng nên rất ồn , mong trường có thể đổi phòng học khác , em xin cảm ơn !",0,8382
giảng viên đem kiến thức vào giảng dạy rất đa dạng .,2,8383
có cho các bài tập vừa sức sinh viên và tích cực giải đáp thắc mắc .,2,8384
giải đáp nhanh khi sinh viên không hiểu .,2,8385
"phương pháp giảng dạy còn thô , không sinh động .",0,8386
"thầy rất tâm huyết , chuyên tâm dạy .",2,8387
thầy có khiếu hài hước rất cao và truyền đạt dễ hiểu .,2,8388
thêm nhiều tài liệu cho sinh viên .,0,8389
"em ở nhà tự học , thi thực hành vừa rồi cũng được 10 điểm .",2,8390
"biết tạo điều kiện cho học sinh rèn luyện các kỹ năng , khả năng dẫn dắt truyền đạt tốt .",2,8391
"nhiều phòng thực hành không có visual hay dev , rất bất lợi cho những bạn chưa có lap .",0,8392
"thân thiện , gần gũi , cách giảng lấy ví dụ thực tế hóa .",2,8393
"rất nhiệt huyết , hay trao đổi và thảo luận và giúp đỡ sinh viên .",2,8394
chương trình dạy rời rạc và khó hiểu .,0,8395
"giảo viên hài hước , giảng kiến thức dễ tiếp thu .",2,8396
"cách dạy lôi cuốn sinh viên , nói chuyện thực tế , gần gũi với sinh viên .",2,8397
cách truyền đạt hài hước .,2,8398
"giảng dạy nhiệt tình , đảm bảo đầy đủ giờ lên lớp .",2,8399
nên thêm máy tính thực trong phòng thực hành .,0,8400
cô rất vui tính và nhiệt tình .,2,8401
cần thống nhất giữa nội dung lý thuyết và phần thực hành học từ trên xuống mà thực hành thì dưới lên gây khó khăn cho sinh viên .,0,8402
hơi khắt khe quá với sinh viên .,0,8403
thuộc bài một cách máy móc và trình bày không tự nhiên nhưng điểm vẫn cao .,0,8404
thầy chỉ tận tình các lỗi xảy ra trong bài học .,2,8405
giọng nói hay .,2,8406
ít cho bài tập về nhà .,0,8407
thầy dạy khá nhiệt tình và tận tâm dễ hiểu .,2,8408
"hình thức , các hoạt động học tập phong phú .",2,8409
thời gian chỉ được phân bổ 2 tiết nên vừa mất thời gian lại không có thời gian để giảng thêm nhiều vấn đề .,0,8410
"giảng viên rất tận tình chỉ dạy , hỗ trợ tích cực .",2,8411
"truyền đạt dễ hiểu , giảng viên hài hước , tạo không gian học tập hưng phấn khi đến lớp .",2,8412
có nhiều nguồn tài liệu slide bài giảng .,2,8413
"thích cách dạy như kể chuyện , chia sẻ kinh nghiệm của thầy .",2,8414
hướng dẫn kỹ trước khi thực hành .,2,8415
"môn học nên bám sát vào nội dung , mục đích cuối cùng thay vì giảng dạy lý thuyết tràn lan .",0,8416
thầy chia sẻ nhiều điều trong thực tế .,2,8417
"em hi vọng thầy có thể cung cấp tài liệu học tập một cách đầy đủ , vì trên slide em thấy còn hạn chế về kiến thức và quá tóm tắt .",0,8418
"đi trễ 2h đồng hồ , nghỉ không thông báo , nhờ người dạy thay thế .",0,8419
giảng viên chủ động .,2,8420
"lớp muốn hiểu bài phải sắp xếp thời gian , tiết học của mình để được học ké , học chui ở các giảng viên khác để lắp cho mình bù lại kiến thức bị trống .",0,8421
"giảng viên nhiệt tình , quan tâm sinh viên , hướng dẫn tốt .",2,8422
tích cực hướng dẫn khi sinh viên hỏi bài .,2,8423
cần có tiết sửa bài tập .,0,8424
"vui vẻ , nhiệt tình , thân thiện .",2,8425
giảng viên thường hay đi trễ nửa tiếng .,0,8426
"máy chiếu không rõ , hư hỏng , chập chờn .",0,8427
"giảng viên chưa nắm rõ chương trình , có khi không fix được lỗi để giảng cho sinh viên mà giao bài tập bắt sinh viên làm , trong khi giáo trình môn học gửi trên moodle không đáp ứng được lượng kiến thức cần thiết , còn quá sơ sài , không cụ thể , và đôi khi không có tài liệu luôn đặc biệt là về phần c .",0,8428
có thêm các mô hình thực tế cho sinh viên .,0,8429
"điểm danh , làm bài kiểm tra thường xuyên trong các buổi học .",1,8430
có tương tác tốt với sinh viên .,2,8431
thầy rất tâm huyết .,2,8432
nói chuyện hơi khó nghe .,0,8433
"giáo viên cần phải ra nhiều bài tập cho sinh viên làm rồi sửa chứ không chỉ nói sinh viên tự kiếm bài tập ở nhà làm để lên bảng sửa , hình thức sửa quá nhanh khiến sinh viên chưa hiểu rõ được vấn đề .",0,8434
nội dung giảng dạy khá tốt .,2,8435
"dạy dễ hiểu , nhiệt tình .",2,8436
"giảng viên tận tâm , nhiệt tình , khả năng truyền đạt tốt .",2,8437
"cô giáo trẻ trung , hòa nhã với sinh viên .",2,8438
"đến lớp đúng giờ , vui tính .",2,8439
"giờ học sinh động , thầy tạo ra không gian để sinh viên trao đổi vấn đề và nêu ra ý kiến của mình .",2,8440
thầy nên hướng dẫn thực hành trong giờ học thực hành .,0,8441
"giảng viên nhiệt tình , công tâm , quan tâm sinh viên , truyền đạt tốt .",2,8442
không có gì để phàn nàn .,1,8443
"đây là năm đầu tiên thầy giảng dạy , chúng em đều thông cảm !",0,8444
"giảng viên nhiệt tình , em cảm thấy hài lòng .",2,8445
"vui vẻ , dạy dễ hiểu , giúp đỡ mọi lúc mọi nơi .",2,8446
thầy dạy hơi nhanh nên khó chép bài kịp .,0,8447
"giảng viên hòa đồng , gần gũi với sinh viên .",2,8448
đây là mong muốn của em chứ không phải không hài lòng ) .,1,8449
nhiệt tình chu đáo với sinh viên .,2,8450
cho đề thi hơi khó .,0,8451
"nghỉ học không thông báo hoài , bực mình .",0,8452
thầy rất tận tâm với sinh viên .,2,8453
cô dạy nhiệt tình và rất gần gũi với sinh viên .,2,8454
chúc thầy thành công !,2,8455
cô không hiểu rõ được tâm lý sinh viên công nghệ thông tin nên khi nào cô cũng áp đặt là bọn em phải chăm chỉ học hành .,0,8456
thầy dạy được cách tư duy sáng tạo .,2,8457
"phần thực hành quá sơ sài , trợ giảng cho thực hành chỉ đưa tài liệu tiếng anh cho đọc và đưa bài về cho làm , không có sự hướng dẫn .",0,8458
nhiệt huyết với sinh viên .,2,8459
"giáo viên tận tình chỉ bảo , tạo không khí vui vẻ .",2,8460
dạy nhiệt tình giúp đỡ sinh viên nhiệt tình trong giờ học và chỉ bài tận tình .,2,8461
đôi khi giảng khó hiểu .,0,8462
thực hành không liên quan gì lý thuyết .,0,8463
"nội dung chương trình học cần rõ ràng hơn , cần cập nhật chương trình học , nội dung bài giảng trên slide còn lủng củng .",0,8464
"thầy dạy quá nhanh , nhất là chiếu slide , tụi em còn không xem kịp nội dung trên slide thì thầy đã cho chuyển sang slide khác .",0,8465
"thầy nên dạy chậm và dễ hiểu hơn , nên giảng từng cái cho chắc rồi hãy sang phần khác .",0,8466
"giảng dạy tích cực , vui vẻ .",2,8467
cập những những kiến thức mới ở ngoài vào giảng dạy .,2,8468
thầy và cô thường có những lời khuyên định hướng tương lai .,2,8469
giảng viên dạy học rất tâm huyết .,2,8470
mong trong học kỳ tới thì chất lượng giảng dạy sẽ cải thiện hơn .,0,8471
"cách dạy hài hước , không gây buồn ngủ .",2,8472
thầy thường xuyên bỏ lớp .,0,8473
"dạy đúng chủ đề , không nói chuyện ngoài lề , đi dạy đúng giờ .",2,8474
mong thầy có thể làm slide kỹ lưỡng và dễ hiểu hơn .,0,8475
"thường xuyên lên lớp trễ , chấm điểm trên moodle không có ghi chú cụ thể dẫn đến nhầm lẫn trong sinh viên .",0,8476
"cô rất tận tâm , nhiệt tình , đem hết kinh nghiệm cũng như kiến thức của mình để truyền đạt cho sinh viên , cô luôn tạo cảm hứng học tập .",2,8477
"thầy dạy cực vui , kiến thức đầy đủ , gần gũi với sinh viên .",2,8478
"cô vui vẻ , nhiệt tình , tận tụy .",2,8479
"giảng viên cởi mở dễ tiếp xúc , trao đổi .",2,8480
"phòng thực hành nhỏ không đủ máy cho sinh viên , máy có nhiều virus .",0,8481
cung cấp tài liệu tự học nhiều hơn .,0,8482
"thầy dạy không sát với chương trình của khoa , một số phần quan trọng nhưng không được chú trọng .",0,8483
phòng máy thực hành cần nâng cấp .,0,8484
thầy rất vui vẻ và tâm lý .,2,8485
ở lớp khi ngồi ở những bàn sau nhìn bảng rất khó .,0,8486
dạy ổn .,2,8487
"cô rất nhiệt tình với sinh viên , giảng dạy kỹ lưỡng , tâm huyết .",2,8488
"giảng viên sử dụng thời gian hợp lý , trình bày chi tiết dễ hiểu .",2,8489
giảng bài rất kỹ và rất hay .,2,8490
"kiến thức của giảng viên rất tốt , cách trình bày , giảng dạy rất đẹp và hiệu quả .",2,8491
nên có nhiều tiết làm bài tập hơn .,0,8492
nhìn không rõ .,0,8493
giảng viên còn hơi chủ quan nghĩ rằng sinh viên nắm được những cái cơ bản ban đầu .,0,8494
phương pháp dạy đưa nhiều bài tập giúp học sinh đa phần nắm được kiến thức .,2,8495
thầy giảng rất tận tình .,2,8496
"vui tính , hay kể chuyện cười cho học sinh .",2,8497
cho phép sinh viên tự giác ôn tập .,1,8498
quý thầy lắm .,2,8499
các đường link tham khảo không đáp ứng tốt nhu cầu giải quyết vấn đề .,0,8500
thầy dạy rất tốt cứ tiếp tục phát huy ạ !,2,8501
"giảng viên ít trình bày kiến thức cần thiết cho sinh viên , giảng viên gợi ý cho sinh viên nhưng gợi ý khá ít gây khó khăn cho sinh viên .",0,8502
giảng viên chưa giải thích rõ nội dung của bài và cách tiến hành mặc dù nội dung phần lý thuyết đó sinh viên chưa học tới hoặc có giảng nhưng còn rất mơ hồ .,0,8503
thầy nên cho một ít bài tập về nhà làm để củng cố kiến thức thêm tại bài tập thi bao la em không biết cái nào là trọng tâm hết .,0,8504
còn hạn chế về chuyên môn trong quá trình giảng dạy .,0,8505
"giáo viên nhiệt tình , có chuyên môn cao .",2,8506
thầy dễ chịu nên tiết học diễn ra vui vẻ không nhàm chán .,2,8507
nhiệt tình và thân thiết với học sinh .,2,8508
"kiến thức mở rộng , giáo viên nhiệt tình .",2,8509
cho làm debate về thực tiễn .,2,8510
"thầy rất vui tính , vi dụ thực hành tại máy trực tiếp và thực tế .",2,8511
tận tâm với sinh viên .,2,8512
bài tập thực hành mang tính vận dung cao những kiến thức đã học và sự hướng dẫn tận tình của giàng viên .,2,8513
hạn chế ra ngoài quá nhiều khi giảng dạy .,0,8514
giáo viên dạy hay !,2,8515
phong cách truyền đạt của cô khiến em còn hơi khó hiểu .,0,8516
"học anh văn nên học ở phòng lab , cách âm để khi học listening không bị ảnh hưởng bởi bên ngoài .",0,8517
còn lại ok hết !,2,8518
lớp học đăng ký lúc đầu gần 10 người nhưng sau 2 ngày thì đi học chỉ còn khoảng từ 15 - 20 sinh viên học .,0,8519
"cô dạy nhiệt tình , lên lớp đầy đủ .",2,8520
"giống giải tích 1 , không biết được mục tiêu đạt được môn học .",0,8521
hòa đồng với sinh viên .,2,8522
"học được nhiều từ vựng chuyên sâu hơn , giáo viên rất tận tình .",2,8523
nên bỏ hình thức thực hành 2 này .,0,8524
không hướng dẫn nhiều về môn học cho sinh viên .,0,8525
"giảng viên nhiệt tình , tận tâm nên em không có ý kiến .",2,8526
"tác phong và phương pháp giảng bài hiện đại , gần gũi , dễ tiếp thu .",2,8527
thầy chia sẻ rất nhiều kinh nghiệm thực tiễn giúp sinh viên định hướng nghề nghiệp tốt hơn .,2,8528
"deadline cho rất ngắn , học buổi chiều và deadline vào lúc 23h59 cùng ngày .",0,8529
"giảng nhiệt tình , ôn tập tốt .",2,8530
"giảng viên tận tâm , nhiệt tình , có khả năng truyền đạt tốt .",2,8531
tạo hoạt động thực hành theo nhóm rất hay .,2,8532
"nhiệt tình và hòa đồng với sinh viên trong giảng dạy , tính tình hiền lành và dạy rất hay , rất yêu nghề .",2,8533
giảng dạy hay thầy rất nhiệt tình slide bài giảng thầy chuẩn bị tốt .,2,8534
chưa đảm bảo tiến độ học tập .,0,8535
lớp được nghỉ liên tục .,0,8536
"giáo viên giảng dạy nhiệt tình , có trách nhiệm , truyền đạt dễ hiểu .",2,8537
tận tình chỉ bảo cho sinh viên những kiến thức bị hổng !,2,8538
cần có đề cương rõ ràng ngay từ đầu .,0,8539
"sinh viên khó có thể tự tìm hiểu để học môn này tốt được , trong khi môn này là môn chính của chuyên ngành .",0,8540
"nhiệt huyết , có tâm tận tình chỉ dạy .",2,8541
cho quá nhiều bài tập về nhà .,0,8542
giáo viên tích cực trong giảng dạy .,2,8543
khả năng truyền đạt kiến thức rất tốt .,2,8544
đi học trễ .,0,8545
thầy nhiệt tình và rất gần gũi với tụi em .,2,8546
"cách chấm điểm quá trình của thầy quá gắt , nhiều bạn bị kéo điểm nặng nề .",0,8547
"nếu lần sau có môn thầy , em nhất định sẽ đăng ký colonsmile .",2,8548
bài tập thực hành có nhiều câu quá khó .,0,8549
"hướng dẫn bài tập đầy đủ , phương pháp giải hay !",2,8550
nâng cao khả năng tự học của sinh viên .,2,8551
"thầy dạy tốt , cho bài tập nhiều .",2,8552
thầy nên up nhiều code mẫu hơn .,0,8553
cô dạy nhiệt tình và tâm huyết .,2,8554
khi được sinh viên nhờ hỗ trợ làm bài thầy mới đến nơi và giúp đỡ .,0,8555
very good .,2,8556
mặc dù điểm thi em không cao do em làm bài không dò lại coloncontemn .,1,8557
thời gian học ít .,0,8558
thầy cũng nên soạn slide bài giảng để chiếu trên lớp như thế sẽ đỡ tốn thời gian thầy ghi chép trên bảng rất nhiều .,0,8559
cần cho nhiều bài tập về nhà hơn nữa .,0,8560
không nhiệt tình trong giảng dạy .,0,8561
"có rất nhiều thiết bị đang xuống cấp và hư hỏng , ảnh hưởng đến chất lượng giảng dạy .",0,8562
thầy luôn có những câu chuyện để làm tăng động lực học .,2,8563
"tốt , nhiệt tình , giỏi .",2,8564
tận tâm giúp đỡ sinh viên .,2,8565
rất nhiệt tình và tâm huyết .,2,8566
thầy rất nhiệt tình ạ .,2,8567
