sentence,label,idx
"thầy wzjwz246 rất nhiệt tình trong giảng dạy và luôn tham khảo thêm nhiều ý kiến của sinh viên , thường xuyên thảo luận trên diễn đàn môn học .",2,5646
"quá trình giảng dạy không bám sát đồ án môn học , sinh viên phải tự tìm hiều qua nhiều mới báo cáo đồ án kịp tiến độ , không nên tổ chức thi giữa kỳ mà thay vào đó là các bài tập nhỏ cộng điểm cho sinh viên .",0,5647
cám ơn thầy đã quan tâm và chú ý .,2,5648
nên thi theo hình thức ra đề .,0,5649
"thầy dạy rất nhiệt tình , hiệu quả .",2,5650
cô rất nhiệt tình tuy nhiên cách cô giảng dạy đối với em khá khó hiểu .,0,5651
giảng rất chi tiết .,2,5652
"không thấy giảng viên dạy thực hành buổi nào , lên lớp 2 tiết tâm sự với sinh viên .",0,5653
giảng viên tạo sự thu hút đối với sinh viên .,2,5654
thầy tránh phương pháp đưa công thức và đưa các ví dụ sinh động .,2,5655
"cô rất nghiêm , song rất nhiệt tình , rất công bằng , có thưởng có phạt , rất đồng tình với cách xét của cô , về bài giảng , rất sinh động , chèn các video thực tiễn , tư liệu đưa vào rất nhiều , rất cụ thể .",2,5656
"giáo viên trẻ trung , năng động , nhiệt tình , vui vẻ .",2,5657
cô dạy tốt colonlove .,2,5658
giáo viên nhiệt tình hòa đồng .,2,5659
"thầy vui tính , dễ gần , cởi mở , nhiệt tình , năng nổ .",2,5660
"thầy dạy dễ hiểu , ví dụ thực tế .",2,5661
buổi học cuối cùng trước đợt thi cuối kỳ chưa nói rõ về nội dung sẽ được thi .,0,5662
bài tập làm đầy đủ .,1,5663
"nhiệt tình giảng dạy , hướng dẫn sinh viên .",2,5664
"thầy nên đưa ra những ví dụ trong khi giảng bài , lý thuyết nhiều rất buồn ngủ khó tập trung được .",0,5665
tập patin rất dễ .,2,5666
"phương pháp giảng dạy chưa hợp lý , đa phần là đọc slide .",0,5667
"đến ngày thầy ôn thi , cho em vài bài tập thì bọn em đã không biết làm nhưng thầy vẫn bắt bọn em giải rồi thầy mới giải .",0,5668
bài đồ án cuối kỳ thì phổ biến không rõ ràng phải làm gì để có điểm cao .,0,5669
"cách dạy thoải mái , nhẹ nhàng , nhiệt tình .",2,5670
trang thiết bị cho thực hành tốt hơn .,0,5671
giáo viên luôn dạy quá thời gian quy định trong khi chỉ có 3 tiết mà thầy dạy gần hết 5 tiết mới cho nghỉ .,0,5672
nghiêm .,1,5673
anh wzjwz302 rất vui và nhiệt tình .,2,5674
thầy rất nhiệt tình và tạo không khí vui vẻ trong lớp học .,2,5675
giảng viên trên lớp liên hệ thực tế quá nhiều .,0,5676
giáo trình cụ thể hơn .,0,5677
em xin đề xuất thêm những buổi thực hành để nâng cao tầm hiệu quả của môn học .,0,5678
nâng cấp quạt trần và máy chiếu của phòng học !,0,5679
cách truyền đạt chưa thuyết phục .,0,5680
đề nghị giảng viên sử dụng moodle để tăng chất lượng dạy học .,0,5681
"cô nhiệt tình , giảng dạy tốt , quan tâm tất cả học sinh .",2,5682
"tăng thời gian thực hành , sinh viên nên được làm việc với các thiết bị thực tế .",0,5683
giảng viên nghỉ quá nhiều !,0,5684
giọng nói của giảng viên khó nghe .,0,5685
thầy cho ít dạng bài tập .,0,5686
cách nói của giảng viên khó nghe .,0,5687
"kiến thức dễ hiểu , tiết học vui .",2,5688
mở thêm các lớp training chuyên ngành .,0,5689
giảng dạy còn một số chỗ hơi khó hiểu .,0,5690
cô giáo nhiệt tình trong lúc dạy .,2,5691
thầy dạy bù vào thời gian không hợp lý .,0,5692
ít bài tập về nhà .,0,5693
"có ví dụ trực quan , sinh động .",2,5694
"bài tập về code hơi ít , thực hành chưa đi đôi với lý thuyết .",0,5695
giảng viên truyền đạt kiến thức rất hay và dễ tiếp thu .,2,5696
cô dạy được .,1,5697
"sử dụng slide , máy chiếu .",0,5698
"giảng viên tận tâm , nhiệt tình , dạy dễ hiểu .",2,5699
dạy hơi khó hiểu và nói quá nhanh .,0,5700
thầy rất chịu khó lắng nghe ý kiến của sinh viên .,2,5701
"giáo viên dạy tân tâm , dễ hiểu .",2,5702
"thầy giảng rất tốt , em hiểu gần như mọi thứ thầy dạy và áp dụng tốt nó .",2,5703
chúng em gửi lời cám ơn đến thầy wzjwz213 !,2,5704
"thời gian lên lớp sinh viên chúng em không được học gì từ thầy , chỉ toàn là tự tìm hiểu .",0,5705
cô dạy em rất buồn ngủ .,0,5706
đánh giá môn học sơ sài và không công bằng .,0,5707
cần có cách khác phù hợp hơn .,0,5708
đảm bảo tốt giờ lên lớp .,2,5709
giảng dạy tích cực và dễ hiểu .,2,5710
"cô rất nhiệt tình , vui tính , biết quan tâm học sinh .",2,5711
"thầy dạy nhiều kiến thức mới , cập nhật từ thực tế .",2,5712
"tuy nhiên , bài tập thực hành còn hơi đơn giản và chưa thực sự phù hợp với thực tế .",0,5713
nói lý thuyết hay nhưng không biết áp dụng vào đâu .,0,5714
"nên dạy đúng giáo án và thời khóa biểu , đừng kéo dài tới 1h30 mới cho ra , trong khi thời khóa biểu là 9h45 là hết .",0,5715
phòng thực hành quá chật và thiết bị cũng hạn chế về số lượng chưa đáp ứng được nhu cầu học tập .,0,5716
em thấy nên tăng thêm nhiều bài tập kèm theo ôn lại khái quát lý thuyết rồi mới vào thực hành những phần lý thuyết đã học .,0,5717
"giảng viên theo sát chuyên cần lớp , giảng dễ hiểu .",2,5718
thật sự em rất mơ hồ về môn học này .,0,5719
đề nghị giảng viên phải theo sát với thực tế hơn .,0,5720
cho ghi bài nhiều .,0,5721
thầy bận lịch của trường nên một vài buổi học thầy không lên lớp được .,0,5722
"thầy bao vui , nói chung chưa bao giờ em thấy học mà vui như thế colonsmile .",2,5723
thầy thường xuyên vắng mặt .,0,5724
thầy dạy rất nhiệt tình và dễ hiểu .,2,5725
"giảng viên am hiểu sâu , giảng bài tận tâm .",2,5726
giảng viên luôn nhiệt tình với sinh viên .,2,5727
"thầy giảng bài tận tình , dễ hiểu ( nếu hỏi riêng ) .",2,5728
"dạy có tâm , kỹ và nhiệt tình .",2,5729
"dạy hay , đúng trọng tâm .",2,5730
giảng viên thường đưa những chuyện vui vào buổi học giúp sinh viên hứng thú trong giờ học hơn .,2,5731
thường xuyên mời các bạn lên giải bài tập và giảng giải lại !,0,5732
nhiệt tình giúp đỡ hỗ trợ cho sinh viên hiểu bài tối đa .,2,5733
"giảng viên cần tập trung giảng dạy lợi ích liên quan thực tiễn , tránh gây nhàm chán và lặp lại quá nhiều kiến thức cũ .",0,5734
"hay dễ hiểu , nhiệt tình .",2,5735
"thầy dạy nhiệt tình , bài giảng hay , dễ gần !",2,5736
béo quá không tốt cho sức khỏe .,0,5737
"thầy dạy tốt , tận tình .",2,5738
cô cần quan tâm hơn tới sinh viên .,0,5739
giảng viên cần thay đổi cách giảng dạy .,0,5740
"thầy thân thiện , dạy dễ hiểu , phương pháp giảng dạy hay .",2,5741
chưa thấy được sự cần thiết thực sự của môn học đối với ngành nghề cũng như cuộc sống sau này .,0,5742
"giảng viên rất tận tâm , giảng dạy kỹ lưỡng .",2,5743
do học buổi trưa cả thầy và trò đều mệt .,0,5744
"cô giáo nhiệt tình , vui tính , cố gắng truyền đạt cho sinh viên .",2,5745
giảng viên dạy dễ hiểu tận tình .,2,5746
em nghĩ là nên giảm số giờ nói lý thuyết cho thêm giờ làm bài tập .,0,5747
cô rất nhiệt tình và dễ thương .,2,5748
"thầy dạy hay , nhiệt tình , dễ hiểu , tận tâm với sinh viên .",2,5749
"cuối cùng , em xin cảm ơn vì thầy fraction cô đã đọc đến hết .",1,5750
tuy nhiên học thầy em có hơi sợ vì thầy nổi tiếng khó khi chấm đồ án .,0,5751
"giảng viên nhiệt tình , hướng dẫn tận tâm cho sinh viên .",2,5752
"thầy chỉ vô điểm danh và quản lý lớp , người dạy là các sinh viên của một câu lạc bộ sinh viên đại học quốc gia .",0,5753
"nhiệt tình , khá dễ hiểu .",2,5754
giảng viên nhiệt tình và tận tâm trong việc giúp sinh viên nắm được kiến thức .,2,5755
"đề nghị nhà trường làm tốt khâu cở sở vật chất , em thấy trường mình còn thiếu nhiều về trang thiết bị thực hành cho sinh viên .",0,5756
thầy giảng dạy tận tâm .,2,5757
"hiện tại các thiết bị phòng lab để thực hành môn này đều đã hỏng , trong suốt quá trình thực hành chúng em không thể thực hành được trên thiết bị , mặc khác cũng chẳng nhận được sự hỗ trợ hướng dẫn nào của giảng viên thực hành .",0,5758
"giảng viên nên sử dụng trang moodle để gửi bài tập hay thông báo khẩn học bù ngoài dự kiến , gửi bảng điểm , vdotv .",0,5759
giảng bài còn hơi nhanh .,0,5760
"khả năng hoạt động nhóm , tinh thần tự học cao .",2,5761
"giảng viên tận tâm , giúp đỡ sinh viên khi không hiểu bài .",2,5762
"nói nhanh quá , nên nhấn mạnh ở những cái đáng chú ý .",0,5763
tài liệu ít được cập nhật .,0,5764
em không có bất cứ sự hài lòng nào đối với hoạt động giảng dạy của giảng viên wzjwz297 .,0,5765
"giáo viên thường xuyên gây cười , tạo hứng thú học tập .",2,5766
"nên đa phần chúng em phải chia nhau ra để học , như vậy chất lượng rất khó đảm bảo .",0,5767
"nhiệt tình , tận tụy .",2,5768
"giáo viên cung cấp tài liệu đầy đủ , đến lớp đúng giờ , dạy nhiệt tình .",2,5769
slide tiếng việt của trường có nhiều chỗ bị sai .,0,5770
rất thích phong cách dạy của thầy x .,2,5771
"cô rất nhiệt tình , tâm lý với sinh viên .",2,5772
"phương pháp dạy học không hấp dẫn , nhàm chán , khả năng truyền đạt chưa hiệu quả .",0,5773
không có gì để nói .,1,5774
"cô dạy rất mơ hồ , không hứng thú , không nhiệt tình giúp đỡ sinh viên .",0,5775
thầy cho nghỉ quá nhiều .,0,5776
"đồng thời , những tiết thực hành giúp em hiểu nhiều hơn những gì em đọc từ tài liệu .",2,5777
"rèn luyện kiến thức chuyên môn , tận tâm , nhiệt tình hơn .",2,5778
đảm bảo thời gian lên lớp và sử dụng thời gian lên lớp hiệu quả .,2,5779
thầy không tạo được cảm hứng cho học sinh .,0,5780
giảng viên dạy có tâm huyết .,2,5781
giảng viên rất hay .,2,5782
"giáo viên nhiệt tình , luôn đảm bảo giờ lên lớp , truyền đạt kiến thức hiệu quả .",2,5783
thêm nhiều kiến thức ngoài mới .,2,5784
chất lượng đào tạo môn học hiện nay tương đối đạt .,2,5785
"chứ em nghĩ phần thư viện standford dùng để phân loại văn bản theo phương pháp naive bayes mà thầy wzjwz133 sử dụng và áp dụng được chắc cần thời gian để nghiên cứu , tìm hiểu mà không được công bố và cho sinh viên áp dụng thì uổng và tội cho thầy wzjwz133 quá !",0,5786
không nắm bắt được kiến thức môn học .,0,5787
giảng dạy dễ hiểu và có tâm .,2,5788
giáo viên thường xuyên cho nghỉ .,0,5789
cô hướng dẫn nhiệt tình và tận tâm với sinh viên trong môn học .,2,5790
không ý kiến gì .,1,5791
sự nhiệt tình và tận tình của giáo viên .,2,5792
tài liệu sử dụng nhiều kí hiệu nhưng không rõ ràng và các định nghĩa mang tính tổng quát quá cao gây sự khó hiểu cho sinh viên và khó khăn cho sự truyền đạt của giảng viên .,0,5793
"khả năng truyền đạt kiến thức chưa cao , nhiều sinh viên khó hiểu .",0,5794
"thầy cho điểm bằng đồ án , rất thực tế !",2,5795
về cách cho sinh viên thảo luận nhóm .,1,5796
quá dễ thương nên học sinh khó lòng mà rớt được .,2,5797
thầy dạy chán .,0,5798
thầy nói tiếng anh dễ hiểu nhưng đôi lúc quá nhanh .,0,5799
"không biết là do môn khó hay sao nhưng em vẫn không hiểu gì về môn này , giáo viên dạy nghe chán chán , không hào hứng học tập .",0,5800
chứ nói thật là bọn em làm bài tập tại lớp không kịp ạ .,0,5801
cho lớp leo cây nhiều quá .,0,5802
cô trả lời các câu hỏi của sinh viên khá chi tiết !,2,5803
cách truyền đạt tốt .,2,5804
"dễ hiểu , được thực hành nhiều , sôi nổi .",2,5805
"sự nhiệt tình , năng động , kiến thức tốt , xinh đẹp , dễ mến , vui vẻ , phát âm chuẩn .",2,5806
khả năng truyền đạt lại kiến thức không được tốt .,0,5807
thầy rất hiền và nhiệt tình trong từng tiết học .,2,5808
cách thức thông báo qua facebook không hiệu quả .,0,5809
minh họa thực tiễn bài học trên máy tính giúp sinh viên hiểu rõ vấn đề .,2,5810
"thầy giảng hơi khó hiểu , phức tạp hóa vấn đề , hơi chậm .",0,5811
giảng viên nhiệt tình truyền đạt kiến thức cho sinh viên .,2,5812
"thầy truyền đạt kiến thức tốt , phương pháp hiệu quả để em tiếp thu được môn học .",2,5813
nhất là hạn chế tối đa việc thay đổi phương pháp dạy liên tục dù biết thầy chỉ có ý tốt cho sinh viên nhưng lại có tác dụng ngược .,0,5814
ít vận dụng nhiều vào thực tiễn .,0,5815
có vài điều bất cập là cô giảng đôi lúc giống như hơi đuối .,0,5816
thầy là người dạy môn chính trị có hồn nhất em từng học .,2,5817
"giảng viên yêu cầu cao , khó khăn , gây áp lực tạo sự chán nản cho sinh viên .",0,5818
"giảng viên dễ mến , dễ gần gũi với sinh viên .",2,5819
"thầy dạy nhiệt tình , tốt nhưng không phù hợp với tôi .",1,5820
"cho ít bài tập , ví dụ cho dễ , bài tập cho khó hơn nhiều , thầy chép lý thuyết trên bảng và đọc lại y chang , sinh viên không có kỹ năng giải bài tập một cách uyển chuyển .",0,5821
tài liệu nên được đưa lên moodle .,0,5822
"không đảm bảo thời gian dạy học , thường dạy quá giờ .",0,5823
thầy dạy tâm huyết .,2,5824
cô dạy quá nhanh .,0,5825
không sử dung tiếng anh trong lúc giảng bài lý thuyết để rồi cả slide bằng tiếng anh cũng không hiểu .,0,5826
thầy giảng dạy nhiều kiến thức .,1,5827
"thực hành một đằng , lý thuyết một nẻo !",0,5828
"giáo viên vui tính , dễ gần , đôi khi hài hước , giúp sinh viên thoải mái tiếp thu kiến thức .",2,5829
cô wzjwz194 is the best !,2,5830
"cô nhiệt tình , thương học sinh .",2,5831
"nội dung giảng dạy hơi khó hiểu , đi nhanh , sinh viên khó nắm bắt kịp bài giảng .",0,5832
do việc có giáo viên khác vào dạy thế trong khoảng sau giữa kỳ nên đã xảy ra một số nhầm lẫn về bài học và cách thức tính điểm đồ án nên dẫn đến một số bạn bị điểm thấp .,0,5833
cần có thiết bị và phòng học hợp lý hơn .,0,5834
giảng dạy không truyền đạt được kiến thức nhiều cho sinh viên .,0,5835
có chia sẻ phương pháp học cho sinh viên .,2,5836
đối với người lần đầu tìm hiểu directx với những yêu cầu đặt ra là rất khó .,0,5837
giảng dạy thật sự quá nhanh !,0,5838
vui tính dễ chịu với sinh viên .,2,5839
"môn học cung cấp nhiều kiến thức cần thiết , đặc biệt là cô dạy rất tận tâm và hướng đến sinh viên .",2,5840
do nghỉ cho năm nhất học quốc phòng nên quá trình học bị gián đoạn .,0,5841
"truyền đạt dễ hiểu , nhiệt tình giảng bài , dễ mến .",2,5842
dạy chưa nhiệt tình .,0,5843
"cô dạy rất hay , cuốn hút .",2,5844
môn học này rất thú vị và có ứng dụng nhiều trong thực tiễn cuộc sống !,2,5845
"bám quá sát slide , ít khi đưa ra ý tưởng mới .",0,5846
cô dạy rất hay và dễ hiểu .,2,5847
"giảng viên tận tình , hay giúp đỡ sinh viên .",2,5848
em nghĩ nên giảm bớt chương trình đào tạo với môn này .,0,5849
khuyến nghị nên chia 3 tiết 1 buổi .,0,5850
té patin cũng đau .,0,5851
"bài tập hay , nâng cao .",2,5852
phong cách giảng bài của cô tạo sự cuốn hút người nghe cảm giác thoải mái .,2,5853
"giáo viên nên tránh giảng dài dòng , dễ gây khó hiểu cho sinh viên .",0,5854
kiểu đề thi trắc nghiệm quá phức tạp .,0,5855
thường xuyên cho bài tập làm trên lớp để nắm bài .,0,5856
cách giảng dạy hay .,2,5857
có nhiều bài toán liên quan thực tiễn .,2,5858
thầy cho chép nhiều .,0,5859
thầy dạy hay và tận tình .,2,5860
"dễ chịu và giảng dễ hiểu , tạo cảm giác thích thú cho sinh viên .",2,5861
áp dụng bài học vào thực tế .,2,5862
"phương pháp giảng dạy hay , thu hút .",2,5863
em nghĩ nhà trường nên kiểm tra kỹ trình độ giảng viên trước khi bố trí để họ dạy một môn học nào đó .,0,5864
nhiều lúc cô wzjwz233 hơi nhầm lẫn .,0,5865
nếu không thì coi như lớp đi toi .,0,5866
khả năng truyền đạt kiến thức sinh viên khó tiếp thu hết .,0,5867
"giảng viên có các hoạt động phù hợp với nội dung bài học , tận tâm , nhiệt tình .",2,5868
cô dạy vui .,2,5869
thầy nói khá nhỏ và nhanh cũng không sử dụng giáo án điện tử làm học sinh rất khó tiếp thu .,0,5870
"cho sinh viên sử dụng bóng không đạt yêu cầu , đa số là bóng đã qua sử dụng ( môn bóng đá ) .",0,5871
"giảng viên tận tình , dạy hay .",2,5872
"giảng dạy có tâm huyết với học sinh , và giảng hiệu quả .",2,5873
"cô dạy rất nhiệt tình , giảng rất hay .",2,5874
"thầy wzjwz14 rất tận tâm truyền dạy không những kiến thức chuyên môn mà còn rất nhiều kiến thức , kinh nghiệm quý về cuộc sống .",2,5875
"em rất đồng tình với cách thông tin đến sinh viên của thầy wzjwz134 , thầy thông tin cho sinh viên qua facebook giúp sinh viên nắm thông tin nhanh hơn qua trang courses hay daa .",2,5876
"giảng viên tận tâm , nhiệt tình , kiến thức và khả năng truyền đạt của giảng viên rất tốt .",2,5877
dễ tiếp thu .,2,5878
thầy có phương pháp giảng dạy hiệu quả .,2,5879
"anh văn ở đại học không thể dạy giống như cấp 3 được khi cô dạy lớp im không sôi nổi , chỉ có vài người giơ tay vì câu hỏi không mang tính tương tác , câu trả lời có sẵn trong bài chỉ cần đọc lên nên nhiều người chán không giơ tay , đi học chỉ để điểm danh .",0,5880
"thực sự thì khả năng truyền đạt không hấp dẫn , dễ buồn ngủ và khó hiểu .",0,5881
tài liệu của môn này quá ít .,0,5882
giảng viên nên chấm deadline về nhà sớm hơn .,0,5883
giảng viên giảng dạy rất tận tâm .,2,5884
em cảm thấy hài lòng với môn này .,2,5885
thầy lên lớp sớm .,2,5886
giúp sinh viên nâng cao được khả năng lập trình .,2,5887
"thầy thông cảm cho sinh viên , ra bài tập vừa sức .",2,5888
cần mớ lớp anh văn thêm để nâng cao trình độ cho sinh viên .,0,5889
thầy nói rất lôi cuốn ( mặc dù không cần micro ) .,2,5890
cần tăng thêm số lượng thiết bị thực hành .,0,5891
mong thầy cho thêm bài tập về nhà và share slide .,0,5892
"giáo viên dạy đúng giờ , tận tình giải đáp những thắc mắc của học sinh .",2,5893
"nhưng thầy thử nghĩ nếu em muốn ngủ mà cứ phải lên lớp thì thầy có thích khi nhìn xuống lớp giảng viên thì dạy , sinh viên thì ngủ mà vẫn có điểm danh như vậy thì có được không .",0,5894
"mở các lớp tiếng anh tăng cường , để sinh viên được cải tiến chất lượng học tập tốt hơn , không tính điểm vào học phần , học phí có thể không free .",0,5895
em xim cám ơn !,1,5896
ôn tập tỉ mỉ .,2,5897
sự cố như sau doubledot đang học thì tất cả số đèn của nửa căn phòng đều tắt .,0,5898
nhưng một số phần trong môn học em thấy thiếu thực tế ạ .,0,5899
"cần các thầy xây dựng một bộ giáo trình , tài liệu cụ thể .",0,5900
thầy rất tâm lý và giảng dạy rất nhiệt tình .,2,5901
giảng viên nhiệt tình với sinh viên trong các buổi học .,2,5902
"tận tâm , quan tâm sinh viên !",2,5903
"giảng viên dạy sinh động , dễ hiểu .",2,5904
thầy nên kết hợp hình ảnh và ví dụ hoá cho từng bước của giải thuật ở trong slide thay vì chữ quá nhiều sẽ khiến sinh viên khó tiếp thu hơn .,0,5905
"làm các bài lab trên win server 2012 rất khác so với win server 2003, mà lại toàn cho làm các bài lab trên win server 2003, có vẻ cũ .",0,5906
"giảng viên nên giảng sâu vào chương trình học , tránh lan man , dài dòng .",0,5907
sự vui vẻ .,2,5908
có bài tập rõ ràng .,2,5909
"không rõ "" thu được gì "" từ môn học này .",0,5910
"khi có sự cố về các môn học , thầy cũng gặp lớp để trao đổi , và giúp cho các thành viên trong lớp có hướng giải quyết tốt hơn ( không chỉ về môn học của thầy ) .",2,5911
cô nhiệt tình và thân thiện .,2,5912
chuẩn bị âm thanh trước môn học ổn định để tránh mất thì giờ vì điều chỉnh âm thanh trong phòng học .,0,5913
"thầy nên dạy đúng giờ bắt đầu , đúng giờ kết thúc trừ trường hợp bất khả kháng , bài dài .",0,5914
sau khi học xong 2 môn học wzjwz168 và wzjwz87 lớp do thầy wzjwz88 làm giảng viên lý thuyết và thầy wzjwz89 làm giảng viên em thấy một điều thế này .,1,5915
"giảng viên không sử dụng moodle làm kênh thông tin liên lạc với học sinh , không up slide tài liệu bài giảng lên gây khó khăn cho việc nắm bắt thông tin về yêu cầu môn học và khó khăn trong học tập .",0,5916
"giáo viên vui , tạo cảm hứng cho học sinh hoạt động trong lớp , em rất thích .",2,5917
cô thường xuyên cung cấp bài tập và kiến thức thực tiễn mà các doanh nghiệp dùng để kiểm tra và giảng bài kỹ càng chi tiết .,2,5918
giảng viên dạy hay và nhiệt tình .,2,5919
giáo viên rất nhiệt tình giảng dạy cho sinh viên .,2,5920
thầy giảng thường không đúng trọng tâm bài .,0,5921
phòng học ngay cạnh bên công trường .,0,5922
"môn thực hành cần có bài tập về nhà , tài liệu cập nhật rõ ràng hơn .",0,5923
"giảng hay , nhiệt tình vui vẻ và rất quan tâm đến sinh viên .",2,5924
"giáo viên tận tình , giảng bài dễ hiểu .",2,5925
không có bài giảng trên moodle .,0,5926
nói nhanh trong lúc giảng bài .,0,5927
thầy dạy khá dễ hiểu .,2,5928
"nhiệt tình với tất cả các câu hổi , ý kiến của sinh viên .",2,5929
"cô rất nhiệt tình , luôn tận tâm truyền đạt kiến thức cho sinh viên .",2,5930
thầy bận đôi khi nghỉ không báo trước .,0,5931
"thầy wzjwz255 dạy nhiệt tình , có pha chút hài hước để lớp thoải mái .",2,5932
"thầy dạy rất tâm huyết , dạy chậm và kỹ lưỡng .",0,5933
thầy vui lòng soạn slide bài giảng để tụi em có thể ôn bài ở nhà .,0,5934
mong cô sẽ truyền đạt một cách nhiệt huyết hơn nữa .,0,5935
thầy nhiệt tình !,2,5936
thầy cho nhiều bài tập ok .,2,5937
tiết học sinh động .,2,5938
"giảng viên nhiệt tình , khả năng truyền đạt tốt , tạo cảm hứng cho sinh viên muốn lên lớp .",2,5939
nguồn tài liệu tự học không nhiều .,0,5940
"cô dạy nhiệt tình , có bài tập rèn luyện .",2,5941
"truyền đạt tốt , giọng nói to rõ ràng .",2,5942
thầy wzjwz214 giảng rất hay và đưa ra nhiều ví dụ thực tiễn dễ hiểu .,2,5943
ngôn ngữ thực hành các bài lab của từng bộ môn nên được trang bị trước cho sinh viên .,0,5944
slide hướng dẫn rất trực quan và bổ ích .,2,5945
