sentence,label,idx
slide giáo trình đầy đủ .,2,0
"nhiệt tình giảng dạy , gần gũi với sinh viên .",2,1
đi học đầy đủ full điểm chuyên cần .,0,2
chưa áp dụng công nghệ thông tin và các thiết bị hỗ trợ cho việc giảng dạy .,0,3
"thầy giảng bài hay , có nhiều bài tập ví dụ ngay trên lớp .",2,4
"giảng viên đảm bảo thời gian lên lớp , tích cực trả lời câu hỏi của sinh viên , thường xuyên đặt câu hỏi cho sinh viên .",2,5
"em sẽ nợ môn này , nhưng em sẽ học lại ở các học kỳ kế tiếp .",1,6
"thời lượng học quá dài , không đảm bảo tiếp thu hiệu quả .",0,7
"nội dung môn học có phần thiếu trọng tâm , hầu như là chung chung , khái quát khiến sinh viên rất khó nắm được nội dung môn học .",0,8
cần nói rõ hơn bằng cách trình bày lên bảng thay vì nhìn vào slide .,0,9
thầy rất tận tình và đi dạy rất đúng giờ .,2,10
dễ bị áp lực .,0,11
"đang dạy thầy wzjwz208 đi qua nước ngoài giữa chừng , thầy wzjwz209 dạy thay .",1,12
môn học còn dễ cần nâng độ khó lên nữa .,0,13
"có thể cho sinh viên đi thăm quan nhiều công ty xem quy mô và cách làm việc , để giúp hiểu rõ hơn vê ngành mình đang học .",0,14
hài lòng về tất cả .,2,15
"nhiệt tình , vui vẻ .",2,16
thấy nhiệt tình trong việc trao đổi giúp đỡ về học tập .,2,17
phong cách giảng bài của thầy rất gần gũi với sinh viên !,2,18
giảng dạy kết hợp các hoạt động giải trí có hiệu quả .,2,19
cần tạo các buổi seminar để sinh viên có thể hiểu sâu thêm về các vấn đề trong chuyên ngành nhưng không có trong môn học .,0,20
tiết học thoải mái .,2,21
"thầy nhiệt tình , quan tâm tới sinh viên .",2,22
"giảng dạy nhiệt tình , hướng dẫn chi tiết đến lúc sinh viên hiểu !",2,23
"chưa có nhiều tiết làm bài tập , chữa bài tập trên lớp .",0,24
tài liệu được bổ sung nhiều và đầy đủ trên moodle .,2,25
giảng viên phải nên cho ví dụ cụ thể những phần quan trọng nên nói kỹ có thể lấy ví dụ minh họa tránh việc lập đi lập lại nhiều lần sẽ tạo cảm giác chán cho sinh viên .,0,26
nên biên soạn một tài liệu của chính trường ta .,0,27
không giúp đỡ sinh viên trong những vấn đề xung quanh .,0,28
"bài tập đa dạng , cụ thể .",2,29
"nội dung giảng viên yêu câu seminar hầu như không có tài liệu tham khảo và rất ít ứng dụng trong thực tế , đề nghị có sự thay đổi trong những năm học tới .",0,30
slide up đầy đủ trước mỗi buổi học .,2,31
"nội dung giảng dạy quá nhàm chán , khô khan .",0,32
lượng kiến thức quá nhiều trong một học kỳ .,0,33
thầy chép bảng nhiều .,0,34
"thầy tận tình hướng dẫn cách làm , giải quyết những thắc mắc của sinh viên .",2,35
"chúc các thầy cô , anh chị làm việc vui vẻ !",2,36
"hay , nhiệt tình , dễ hiểu .",2,37
"mặc dù nhiệt tình nhưng khi truyền đạt thì lại khó hiểu , sử dụng ngôn từ gây khó khăn cho việc hiểu bài .",0,38
"thầy dạy khá hay , cung cấp nhiều thông tin liên quan đến môn học , đưa ra nhiều hướng giải quyết khi sinh viên gặp vấn đề khó khăn với đồ án !",2,39
hy vọng học kỳ sau có thể học được với cô .,2,40
nhiều khi em lên lớp học môn đặc tả hình thức giống như lên lớp học mà không biết mình học cái gì .,0,41
trong khi giảng nói nhỏ quá .,0,42
thực hành khó hiểu .,0,43
"thầy rất tận tâm nhiệt tình , quan tâm đến sinh viên , giảng bài dễ hiểu , kiến thức sâu rộng am hiểu cao .",2,44
"cô dạy với nhiệt huyết của mình , dù như thế nào , cô vẫn luôn mỉm cười và kiên trì giảng bài cho chúng em đến khi chúng em hiểu .",2,45
"cô lên lớp đúng giờ , giảng bài rất dễ hiểu cho sinh viên .",2,46
"những thông tin cần thiết như doubledot thời gian dealine , cách nộp bài thường không dặn lớp thực hành thứ hai .",0,47
"thầy nhiệt tình , dễ chịu .",2,48
"giảng viên chưa đi sâu vào bản chất của vấn đề , em chỉ học thôi mà không biết bản chất của nó là gì nó có ứng dụng gì sau này cho chuyên nghành của em .",0,49
đặc biệt hơn là thầy đã bỏ rất nhiều công sức trong việc ra bài tập và chấm điểm một cách rõ ràng và minh bạch .,2,50
cô rất nhiệt tình và tận dụng tốt thời gian .,2,51
"giảng viên tận tâm , nhiệt huyết trong giảng dạy .",2,52
"thầy nhiệt tình , gần gũi .",2,53
"giảng viên tận tâm , giảng dễ hiểu , dễ tiếp thu .",2,54
tạo ra sự cạnh tranh trong mỗi buổi thực hành .,1,55
bài tập và có code tham khảo .,2,56
"cần nâng cấp hệ thống wifi , vì khi vào phòng thực hành , sinh viên không thể truy cập internet , buộc phải xin phép ra ngoài để làm bài .",0,57
tài liệu không chi tiết lắm .,0,58
"tận tâm , nhiệt tình , vui tính , dễ gần với sinh viên .",2,59
thầy dạy rất hay và nhiệt tình .,2,60
"thầy dạy không đúng giờ , không hướng dẫn sinh viên thực hành .",0,61
giúp đỡ học sinh quá ít .,0,62
cô dạy buồn ngủ quá .,0,63
nên kinh mong nội dung môn học được giảm tải cho phù hợp hơn với đặc thù của một trường công nghệ thông tin .,0,64
thầy tận tình vui tính .,2,65
cô lại kiểu khó tính nữa .,0,66
tạo hứng thú cho sinh viên .,2,67
cô giảng hay cuốn hút và truyền đạt dễ hiểu .,2,68
có hứng thú học .,2,69
ôn tập đúng theo thầy nhưng không biết cuối kỳ được mấy điểm .,1,70
"giảng viên hướng dẫn cụ thể , chi tiết .",2,71
giáo trình quá ít và nội dung không khác nhau là mấy .,0,72
"giáo viên nghỉ dạy liên tục , cuối học kỳ lại tăng học bù , những tiết học bù đó đã ảnh hưởng đến những đồ án , và trễ deadline .",0,73
"giáo viên lúc dạy lúc không , không dạy cũng không thông báo , sinh viên tốn thời gian , công sức , tiền bạc rồi ngồi đợi và đi về .",0,74
"cần có một phòng máy tốt hơn , hiện đại hơn .",0,75
thầy nên cho làm bài tập tương tự nhau nhiều hơn một vài bài để tránh tình trạng quên hoặc các dạng tựa nhau nhưng hơi khác cách làm .,0,76
"không ngờ môn này lại chán đến như vậy , không học được gì từ môn này , thầy dạy chán kinh khủng , hay đi trễ từ 30 - 45 phút , không nhiệt tình .",0,77
giảng viên đánh giá sai điểm và năng lực của học sinh .,0,78
không đáp ứng được đề cương môn học đề ra .,0,79
thầy nên hướng dẫn thực hành nhiều hơn .,0,80
"giảng viên thân thiện , quan tâm tới sinh viên .",2,81
"môn lập trình hướng đối tượng nên cập nhật thêm những nội dung mới , dễ hiểu và giảng giải cụ thể hơn .",0,82
"giáo viên nhiệt tình , tâm huyết , khả năng truyền đạt tốt .",2,83
thầy dạy rất tốt và nhiệt tình .,2,84
"cô nói hơi nhỏ , nếu lớp ồn sẽ khó nghe .",0,85
"bài tập cô đưa ra nhiều , và khó tìm hiểu , với kiến thực hiện tại của sinh viên thì khó có thể tìm hiểu và làm tốt bài tập cô ra .",0,86
bài tập và hoạt động nhóm còn ít .,0,87
"giảng viên rất nhiệt tình , phương pháp giảng dạy hay , sinh viên nắm bắt kiến thức ngay trên lớp .",2,88
cô hướng dẫn thực hành khá đầy đủ .,2,89
được học nhiều kinh nghiệm từ thầy wzjwz163 .,2,90
"kiến thức của thầy rất tốt , bảo đảm giờ lên lớp .",2,91
hiện tại em chưa thấy tác dụng gì nhiều khi học môn này .,0,92
cải thiện lại cơ sở vật chất máy chiếu trong phòng học .,0,93
dạy không phù hợp với cách học của em .,0,94
giải thích nội dung mới rõ ràng .,2,95
lớp học quá đông !,0,96
"môn căn bản mà thầy không dạy cho sinh viên kỹ , gây không hiểu , mất căn bản .",0,97
"giảng viên chưa cho bài tập về nhà để sinh viên làm nên cho 5 bài mỗi chương , không cần chữa chỉ cần đáp án .",0,98
"mà hiện tại trường ta chưa có , đây là thiệt thòi lớn đối với tụi em .",0,99
tôi cảm thấy giảng viên dạy rất tốt .,2,100
"không biết thầy nào dạy chính thức , mà học thường nghỉ không thông báo trước để sinh viên đứng chờ sắp hết tiết rồi tự về nhiều lần .",0,101
cần có sự tương tác giữa giảng viên và sinh viên nhiều hơn .,0,102
giảng viên thân thiện nhiệt tình cởi mở .,2,103
"giáo viên có mời các công ty về trình bày , giúp sinh viên cập nhật kiến thức thực tiễn .",2,104
coi lại thái độ giảng viên thực hành .,0,105
"giảng viên nhiệt tình , giải nhiều bài tập .",2,106
bài giảng của thầy rất nhiệt tình .,2,107
"môn học chưa thực tiễn , chưa thu hút sinh viên .",0,108
dạy hơi nhanh !,0,109
ít làm bài tập .,0,110
"giảng bài kém thu hút , vị trí đứng giảng không hợp lý , ôn tập cuối kỳ còn chưa tập trung vào vấn đề .",0,111
"giảng viên nhiệt tình , bài giảng thu hút .",2,112
"nhờ thầy và giảng viên lý thuyết , em đã hiểu rõ về môn này rất nhiều !",2,113
môn này khá trừu tượng nên mong thầy có nhiều liên tưởng tới thực tiễn hơn để chúng em có thể hiểu .,0,114
cần thêm nhiều tài liệu cho sinh viên .,0,115
bài tập trên lớp .,1,116
tăng số tiết dạy lên để sinh viên có nhiều cơ hội hỏi đáp thắc mắc về môn học .,0,117
thầy nhiệt tình dễ hiểu .,2,118
thực hành và lý thuyết nên dạy song song .,0,119
giảng viên dạy nhanh .,0,120
bài tập trên lớp nên được giới thiệu ngay từ đầu tiết học để học sinh không tốn thời gian đọc đề cũng như có thể suy nghĩ cách giải cùng lúc với việc nghe giảng .,0,121
giảng viên cho bài tập hay .,2,122
cập nhật bài tập mới .,0,123
"lên lớp ai làm việc người ấy , thầy không có giảng gì thêm .",0,124
"tận tâm , nhiệt tình , quan tâm đến sinh viên .",2,125
phản hồi giải đáp thắc mắc cho sinh viên .,2,126
dạy quá nhanh .,0,127
mong ban thiết bị sớm khắc phục ạ !,0,128
môn này cần làm đề tài để áp dụng lý thuyết vào thực tiễn mà trên lớp chỉ học một đống lý thuyết và hiếm ai nhớ đa số khá buồn ngủ khi lên lớp .,0,129
"giảng viên nên đổi mới phương pháp giảng dạy , tránh thô cứng , không hấp dẫn sinh viên .",0,130
"nhiệt tình , tạo cách chủ động cho học sinh tiếp cận với môn học và tham gia các chương trình phong trào liên quan để nâng cao kỹ năng .",2,131
"cô dạy rất tận tình , dễ hiểu .",2,132
không đáp ứng được nhu cầu của sinh viên .,0,133
thầy rất nhiệt tình với chúng em và điều này làm em rất hài lòng .,2,134
cách giảng dạy của thầy rất hay và có phần dễ hiễu .,2,135
"nhiệt tình , dễ thương .",2,136
không hướng dẫn đồ án .,0,137
em xin đề nghị nhà trường nên bổ sung tài liệu về môn học và cập nhật nội dung .,0,138
"chép bài rất nhiều , lãng phí thời gian nghe giảng .",0,139
"em không học thầy wzjwz178 kỳ này , giáo viên thực hành có 2 người nên có lẽ daa nhầm .",0,140
đề thi môn dài sinh viên làm không đủ thời gian .,0,141
cho làm nhiều bài test .,0,142
theo em thì nên thi phòng máy nào có visual 2013 trở lên .,0,143
cần thêm nhiều tài liệu cho môn học .,0,144
thầy giảng dạy tốt .,2,145
mong thầy có thể hướng dẫn cách cụ thể nhất cho những bài khó .,0,146
thầy cần cho bài tập và hướng dẫn nhiều hơn .,0,147
"giáo viên lên lớp đúng giờ , giảng bài sôi động .",2,148
em thấy thầy chỉ giảng cho có .,0,149
cần xác định rõ mục đích môn học và cho sinh viên đề cương chi tiết môn học trước khi bắt đầu .,0,150
"thầy nói chuyện với sinh viên rất tự nhiên , chia sẻ kinh nghiệm thực tế .",2,151
dạy theo sát chương trình .,2,152
cung cấp thêm trang thiết bị phục vụ nhu cầu môn học .,0,153
đề nghị nâng cấp phòng lab khoa mạng .,0,154
"thầy giảng hay và tâm huyết , bài giảng có tính thực tiễn cao .",2,155
đi dạy đúng giờ .,2,156
"thầy cung cấp nhiều kiến thức mới , thầy dạy tận tâm và nhiệt tình !",2,157
có tăng thêm nhiều ví dụ để minh họa cho lý thuyết vì có nhiều phần lý thuyết rất trừu tượng .,2,158
các yêu cầu về đồ án môn học nên đươc đưa ra chính xác trước khi sinh viên bắt đầu thực hiện chia nhóm và làm đồ án .,0,159
"dạy dễ hiểu dễ tiếp thu , tập trung vài kiến thức trọng tâm .",2,160
"dạy chưa được kỹ lắm , điểm nên thoáng hơn .",0,161
chưa chuẩn bị kỹ bài giảng để có thể trả lời các thắc mắc của sinh viên trên lớp .,0,162
cô khá tận tâm cho học sinh .,2,163
"cần cải cách lại nội dung các bài thực hành , một số kiến nội dung trong bài thực hành đã trở nên lỗi thời .",0,164
giảng viên có khả năng truyền đạt kiến thức tốt .,2,165
cho làm nhiều bài tập .,0,166
nghiên cứu khoa học .,1,167
"giáo viên dạy rất tận tâm , nhiệt tình .",2,168
thầy cô hướng dẫn đồ án hệ thống thông tin cần có thêm một vài buổi gặp mặt với sinh viên và đưa ra lịch cố định trên trường để sinh viên thắc mắc có thể lên hỏi trực tiếp !,0,169
chỉ thông báo trên lớp sẽ khó tránh sai sót .,0,170
cô viết ở góc bảng gần chổ bụt giảng khiến nhiều khi khó quan sát được ạ .,0,171
đề nghị lắp thêm quạt .,0,172
dạy kỹ .,2,173
bài tập cần đa dạng hơn .,0,174
nói rất nhỏ .,0,175
có lúc làm bài sai giáo viên nói làm hơi tự ái .,0,176
không sửa các bài tập thực hành .,0,177
em chưa hiểu rõ cách thức chấm điểm bài kiểm tra thực hành .,0,178
làm bài tập nhiều mặc dù không hiểu lắm .,0,179
thi thoảng nghỉ học không thông báo trên daa .,0,180
"thầy dạy dễ hiểu , tiết học dễ hiểu , sôi nổi .",2,181
"thầy giảng dạy nhiệt tình , truyền cảm .",2,182
"giảng dạy rất chi tiết , dễ hiểu và dễ tiếp thu .",2,183
truyền đạt những kiến thức tốt .,2,184
cô vui tính .,2,185
nếu có thì chỉ hướng dẫn bằng lý thuyết mà không làm bài tập mẫu cho sinh viên .,0,186
cô chưa có nhiều kênh bài tập cho sinh viên .,0,187
bạn nào khá thì có thể áp dụng công thức vào bài tập cả lớp chưa đến 30% còn thực sự hiểu môn học thì rất ít người hiểu .,0,188
thầy dạy hơi nhanh .,0,189
ít hướng dẫn sinh viên trong giờ thực hành .,0,190
không thực hành được buổi nào .,0,191
"thầy dạy phần lý thuyết hay , nắm bắt được khả năng của sinh viên .",2,192
"ví dụ đề tài của em là doubledot các nguyên lý cơ bản , bao gồm 7 nguyên tắc của bohm ( 1983 ) .",1,193
"giáo viên nhiệt tình , dạy dễ hiểu , tận tình với sinh viên .",2,194
"tân tâm , nhiệt tình trong lớp lẫn bên ngoài .",2,195
thầy giảng dạy tận tâm nhiệt tình .,2,196
"thầy vui tính , giảng bài dễ hiểu , nhiệt tình .",2,197
thầy giáo dạy nhiệt tình .,2,198
"dạy dễ hiểu , gần gũi sinh viên .",2,199
"cô dạy rất nhiệt tình và tài liệu của cô rất cụ thể dễ hiểu , cô hướng dẫn rất tận tình .",2,200
mong thầy cố gắng trong các học kỳ sau .,0,201
cần đưa ra nhiều ví dụ minh họa hơn .,0,202
"giảng viên hoà đồng , vui vẻ , chỉ giảng tận tình sinh viên ham học hỏi .",2,203
giảng viên không dạy một tiết thực hành nào .,0,204
không !,1,205
nên có sự thống nhất giữa các giảng viên bộ môn trong đề cương giảng dạy .,0,206
"có những phần kiến thức chỉ một nửa lớp được học nhưng giảng viên nghĩ là cả lớp đã học rồi nên chỉ overview , những sinh viên còn lại khó nắm được .",0,207
máy tính cập nhật nhanh hơn .,0,208
"vui , hòa đồng , nhiệt tình .",2,209
có giúp đỡ sinh viên học tập nghiên cứu .,2,210
"giảng viên tận tâm , nhiệt tình , ham học hỏi .",2,211
"tuy nhiên cô nên cân nhắc lại về số lượng yêu cầu đối với sinh viên để sinh viên không bị khớp vì quá nhiều dẫn đến làm qua loa cho có , như vậy thì kết quả lại không tốt .",0,212
"cô rất tận tâm , rất ok , em rất thích cách dạy và học của cô ( mặc dù hơi nhanh tí ) .",2,213
mong thầy và nhà trường xem xét lại những điều em vừa nói .,0,214
"thầy tận tâm , nhiệt tình , tạo động lực cho sinh viên .",2,215
"thầy giáo tận tình , dạy kỹ , thường đưa ra câu hỏi để xem xét mức độ hiểu biết của sinh viên .",2,216
cần tăng cương trao đổi giữa sinh viên và giáo viên .,0,217
nói chung là nghe không bao giờ nghe rõ được .,0,218
cách truyền đạt của giáo viên chưa có sức hút đối với sinh viên nhiều cho lắm .,0,219
"cô giáo thân thiện dễ gần , thực hành nhiều .",2,220
chưa tiếp thu trọn vẹn .,0,221
cần cải tiến trang thiết thực hành .,0,222
giảng kỹ hơn .,0,223
còn hơi kéo thời gian .,0,224
có nhiều bài tập về nhà cơ bản lẫn nâng cao và giảng viên sửa bài đủ .,2,225
thầy rất hiền và kiên trì giảng dạy cho lớp mặc dù môn học này đối với em không được hứng thú lắm .,0,226
đôi lúc giảng bài hơi nhanh .,0,227
có một số buổi không đi dạy .,0,228
thầy nhiệt tình và dạy dễ hiểu .,2,229
"có kiến thức nền tảng này , sinh viên có thể học thêm bất kỳ công nghệ cụ thể nào đó dễ dàng , cũng như tiếp thu thay đổi công nghệ mới nhanh chóng .",2,230
"cấu trúc đề cương của thầy chưa rõ ràng , lý thuyết chưa được trình bày rõ trong các buổi học .",0,231
tài liệu hỗ trợ toàn tiếng anh rất khó học .,0,232
chưa nhận được gì từ môn học này .,0,233
"giảng viên không hề giảng dạy , chỉ đưa đề cương rồi thôi .",0,234
bài tập mỗi tuần đều có và đầy đủ .,2,235
em xin cảm ơn .,2,236
thầy cần phải cho sinh viên biết được học môn này có tác dụng gì và làm được gì khi học xong .,0,237
đề nghị tăng thời gian thưc hành .,0,238
không được làm những chuyện riêng trong lúc dạy thực hành .,0,239
hỗ trợ thêm giáo trình không phải slide cho sinh viên .,0,240
cô wzjwz259 rất vui và nhiệt tình .,2,241
"giáo viện nhiệt tình , tận tâm .",2,242
"kiến thức được giảng viên trình bày rõ ràng , dễ hiểu cho sinh viên .",2,243
cần thêm nhiều kit để thực hành .,0,244
dạy khó hiểu quá nhanh .,0,245
"luôn gần gũi , tham khảo ý kiến sinh viên và thống nhất cũng sinh viên .",2,246
sắp xếp lịch học bù chưa hợp lý .,0,247
"nhà trường nên đưa môn học này vào thời khóa biểu bắt buộc ở học kỳ 1 của các sinh viên năm nhất nhằm giúp các em nắm biết được mình nên học gì , mình có nên chuyển đổi ngành hay không .",0,248
thời gian thực hành cần nhiều hơn .,0,249
giảng viên rất nhiệt tình trong giảng dạy .,2,250
slide chuẩn bị chưa tốt .,0,251
thầy hay đòi hỏi sinh viên những điều hơi quá cao .,0,252
cô giảng hướng dẫn nhiệt tình .,2,253
"chúng em đã gặp khó khắn với khổ giấy nhỏ , mô hình thì lớn và phức tạp .",0,254
giảng quá nhiều không đánh vào trọng tâm .,0,255
"em không muốn nói gì nhưng mong thầy xem lại cách đánh giá sinh viên để công bằng hơn , cái sinh viên không biết không phải chỉ ở cúp tiết mà còn ở cách giảng dạy , truyền đạt ở giảng viên , ví dụ như cô wzjwz324 , rất dễ hiểu , tận tâm .",0,256
cô có nhiều hình thức giảng dạy hay .,2,257
hơi khó .,0,258
thầy đi trễ .,0,259
giảng tốt .,2,260
nói mở rộng nhiều vấn đề về môn học .,2,261
cần tăng cường nội dung nghe và nói để sinh viên giao tiếp tốt hơn bằng tiếng anh .,0,262
giảng viên tạo điều kiện làm nhiều bài tập .,0,263
hỗ trợ thêm về các thiết bị dạy và học .,0,264
ít giải bài tập trên lớp .,0,265
chia sẻ .,1,266
bám sát nội dung chính .,2,267
cần thêm các đoạn code cho các giải thuật bổ sung các phương pháp để giải quyết các bài toán liệt kê .,0,268
thông tin đầy đủ về bài tập và các nguồn tham khảo .,2,269
"cô tận tâm , nhiệt tình , phương pháp dạy dễ hiểu .",2,270
"thầy giảng rất dễ hiểu và thú vị , thu hút .",2,271
hướng dẫn chi tiết về cách thực hành .,2,272
"giảng viên chỉ cho đồ án và giải đáp các yêu cầu đồ án , không cung cấp tài liệu hay hướng dẫn cơ bản , sinh viên tự tìm hiểu với lý do là hệ tài năng nên cần tự xoay sở .",0,273
"môn học toàn kiến thức mới mẻ , giảng viên nên giảng chi tiết hơn .",0,274
"đến khi cuối kỳ , chỉ cần sinh viên mắc một sai sót nhỏ thì sẽ rớt môn .",0,275
"cần thay đổi cách dạy và nội dung học của phần thực hành , các bài thực hành hiện tại của môn mạng máy tính chưa đảm bảo hiệu quả .",0,276
"thầy dạy hay , tận tình góp ý từng bài .",2,277
"cơ sở vật chất , phỏng máy không đủ phích cắm cho dụng cụ thực hành và số lượng sinh viên , máy còn tiềm ẩn nhiều virus .",0,278
"trên lớp lý thuyết giảng viên yêu cầu sinh viên phải thực hiện đồ án theo những gì mình hướng dẫn , những nhóm sinh viên bổ sung thêm những liên hệ thực tiễn đều bị cho là sai , không phù hợp với đồ án .",0,279
thầy giảng bài hay và hiệu quả !,2,280
giảng viên nhiệt tình vui vẻ .,2,281
phòng học nên có rèm che sáng để khi chiếu slide được nhìn rõ hơn .,0,282
"chương trình dạy lý thuyết và thực hành nên khớp với nhau hơn , tránh tình trạng thực hành trước khi học lý thuyết .",0,283
"thầy giảng dạy nhiệt tình , dễ hiểu .",2,284
mong giảng viên ngày càng chấn chỉnh việc dạy học để các khoá sau được hiểu tốt hơn .,0,285
"thầy dạy rất có tâm , và giảng cho sinh viên rất nhiều thứ !",2,286
"nội dung khảo sat quá dài , nhiều mục lặp đi lặp lại , nhiều bạn khảo sát mà không cần đọc , toàn tích chàn .",0,287
dạy tốt và rất nhiệt tình chỉ dạy hoc sinh .,2,288
"nhiệt tình , tân tâm .",2,289
"nhưng học mới thấy kiến thức thầy dạy rất hay , bám sát thực tế , thầy dạy rất nhiệt tình , vui vẻ , khác với mọi người nói .",2,290
bài tập rất hay .,2,291
thầy cô cần cho nhiều dạng bài tập sát với đề thi hơn .,0,292
"thầy giảng hay nhưng nên tự tin hơn , nói to hơn để học sinh hiểu bài một cách rõ ràng hơn .",2,293
"mong thầy vui tính , gần gũi với sinh viên hơn .",2,294
"giáo viên vui tính , hòa đồng , nhiệt tình .",2,295
cung cấp kiến thức trọng tâm .,2,296
cố gắng truyền đạt một cách tốt nhất để sinh viên được hiểu .,2,297
giọng của giảng viên nhỏ dù đã sử dụng micro .,0,298
"dù phương pháp học tập này khá hiệu quả nhưng vẫn có chút nào đó nghi ngờ từ phần thuyết trình của các bạn , liệu các kiến thức đó có chuẩn xác và cập nhật chưa .",1,299
giáo viên có phong cách giảng dạy nghiêm túc .,2,300
