sentence,label,idx
"giảng viên rất tận tâm , nhiệt huyết , cô có khả năng truyền đặt cao , cách giảng dạy lôi cuốn , thu hút .",2,3007
"giảng viên tận tình , chu đáo , gần gũi sinh viên .",2,3008
"vui vẻ , cởi mở .",2,3009
thầy giảng dạy rất có nguyên tắc .,2,3010
nên học ở giảng đường sẽ thuận tiện hơn .,0,3011
làm cho một phần học sinh ( chủ yếu khá và giỏi ) cảm thấy chán trong việc lên lớp .,0,3012
"cô dạy nhiệt tình , sẵn sàng giảng lại một phần nhiều lần .",2,3013
cảm ơn thầy wzjwz291 rất nhiều .,2,3014
thầy rất có tâm ạ !,2,3015
có nhiều bài tập về nhà .,2,3016
em có đăng ký học môn khác vào tiết sau và lúc nào cũng bị đi muộn .,0,3017
"đổi mới hình thức kiểm tra , đảm bảo tính chất thực hành của môn học .",0,3018
cơ sở vật chất của trường còn khá kém và thiếu các hoạt động ngoại khóa .,0,3019
một cuốn sách thật dày chỉ là một trong những tài liệu mà tụi em có thể tham khảo .,0,3020
sự nhiệt tình của giảng viên trong quá trình giảng dạy .,2,3021
giáo viên nên tập trung vào các vấn đề cần biết trên lớp để cho các sinh viên hiểu rõ hơn bài tập .,0,3022
em xin chân thành cảm ơn !,1,3023
"dạy rất nhiệt tình , lớp sinh động , truyền đạt tốt .",2,3024
có cho đề mẫu và bài tập để ôn tập .,2,3025
"giảng viên trả lời câu hỏi của sinh viên thiếu chuyên nghiệp ( qua loa , không đúng chủ đề ) .",0,3026
"chú trọng quá nhiều vào lý thuyết , ít bài tập .",0,3027
nhưng ngoài điều đó ra thì giảng viên rất tốt .,2,3028
"nội dung bài giảng hay , phù hợp và truyền đạt nội dung bài kết hợp ví dụ tuyệt vời !",2,3029
tận tình .,2,3030
giảng viên thường không trả lời câu hỏi của sinh viền hoặc là khó chịu khi sinh viên hỏi bài .,2,3031
"bước vào lớp học cứ như "" đi nhầm lớp "" .",1,3032
hay cho nghỉ .,0,3033
không thấy giảng viên trên lớp .,0,3034
chương trình hiện tại chia tới 2 lĩnh vực trong một môn học .,1,3035
"không chỉ truyền đạt đầy đủ kiến thức , thầy còn cho thêm sinh viên nhiều thông tin bổ ích khác .",2,3036
"giảng viên tận tâm , khả năng truyền đạt tốt .",2,3037
những sinh viên đi học vào buổi đó không dự được thì sao có thể viết bài thu hoạch .,0,3038
"giảng viên kém nhiệt tình , nghỉ học một số buổi nhưng không thông báo trên daa .",0,3039
kiến thức được học ở lý thuyết cần được áp dụng một cách thực tiễn vào thực hành .,0,3040
"hiện giờ , giảng viên đã nghỉ 2 tuần mà không báo trước .",0,3041
không phản hồi câu hỏi cũng như tiếp thu ý kiến của sinh viên một cách nhiệt tình và thoả đáng .,0,3042
"cô nhiệt tình , có chia sẻ một số kinh nghiệm hữu ích trong ngành .",2,3043
môi trường không đảm bảo an toàn cho sức khỏe .,0,3044
"giảng rất dễ hiểu , liên hệ thực tế nhiều .",2,3045
"thầy rất vui tính , hòa đồng với sinh viên từ đó truyền đạt khá dễ tiếp thu .",2,3046
thầy nói tiếng anh còn hơi nhỏ .,0,3047
cô dạy slide lý thuyết hơi nhanh .,0,3048
chưa có slide tiếng việt .,0,3049
"thầy dạy nhiệt tình , chỗ nào lớp không hiểu thầy nhiệt tình giảng lại cho lớp .",2,3050
em đã kết thúc một học kỳ ở đó !,1,3051
điểm danh thường xuyên .,1,3052
nội dụng môn học không liên quan đến đề thi .,0,3053
mong giảng viên lưu tâm !,0,3054
"luôn giải đáp những thắc mắc sớm nhất có thể , mở thêm những buổi học ngoài tăng cường kiến thức .",2,3055
giáo viên nên cho nhiều ví dụ nhỏ trên lớp hơn để chúng em dễ tiếp thu .,0,3056
"sinh viên rất khó nắm bắt những gì giảng viên viết và ghi chú trên bảng , phần lớn chỉ có thể giảng dạy bằng máy chiếu , dù tốc độ không quá nhanh nhưng cũng chỉ là những dòng chữ lướt qua , khi về nhà lại phải tự mày mò học lại từ đầu tuy nói rằng nhiệm vụ của sinh viên là phải tìm hiểu bài trước khi đến lớp nhưng với việc giảng dạy trong một giảng đường rộng lớn đã khiến vai trò hỗ trợ của giảng viên trở nên mờ nhạt .",0,3057
"vui tính , năng nổ , dễ dàng tiếp cận sinh viên , cách dạy có hiệu quả .",2,3058
cần giảng dạy theo slide tiếng việt hoặc giảng viên cần chú trọng dịch và giải thích hơn vì sinh viên cũng không giỏi tiếng anh nên khó tiếp thu .,0,3059
"giá tiền tín chỉ thực hành theo hình thức 2 cao hơn , số buổi học ít hơn .",0,3060
có các phương pháp dạy tốt .,2,3061
"giảng viên tận tâm , giảng dạy hiệu quả , có trao đổi và thảo luận trên moodle .",2,3062
bổ sung thêm các trang thiết bị để đáp ứng nhu cầu môn học và cải thiện phòng lab rộng rãi hơn .,0,3063
cần hỗ trọ nhiều máy thực hành hơn cho môn mạch số .,0,3064
"rất tán thành việc giảng viên liên hệ với doanh nghiệp để sinh viên đến tìm hiểu , thực tập về nội dung môn học cũng như có thêm nhiều kinh nghiệm bổ ích .",2,3065
"phòng máy chất lượng kém , rất chậm , liên tục mất điện trong quá trình thực hành .",0,3066
"giảng kỹ , hay .",2,3067
cô dạy tâm huyết và nhiệt tình .,2,3068
"thầy chỉ dạy rất tận tình , hiền .",2,3069
thêm nhiều bài tập về nhà .,0,3070
"nếu có , em nghĩ mục tiêu môn học cần xác định rõ với sinh viên trước khi bắt đầu , em cảm ơn ạ !",0,3071
phòng học thiếu quạt .,0,3072
giáo viên dạy lớp wzjwz315 không phải là cô wzjwz316 .,0,3073
"thầy nên dạy nhiều hơn , nên dạy kỹ lý thuyết hơn .",2,3074
"rất thích học thầy vì thầy dạy dễ hiểu , thẳng thắn , quyết đoán và dạy những thứ thực tế .",2,3075
"cô wzjwz92 rất tận tâm , nhiệt tình hướng dẫn khi sinh viên có thắc mắc , cô sẵn sàng ngồi lại sau giờ học để giải đáp tất cả thắc mắc của các bạn , dù có thể mất 1h .",2,3076
em không có bất kỳ điều gì hài hòng .,0,3077
quan tâm đến sinh viên .,2,3078
thầy dạy hay slide chuẩn bị tốt .,2,3079
"nên nêu rõ mục đích , yêu cầu của môn học khi bắt đầu dạy , để sinh viên nắm được mục đích yêu cầu môn học .",0,3080
"tận tình với sinh viên , dễ hiểu bài .",2,3081
"giảng viên chưa có khả năng truyền đạt , kinh nghiệm đứng lớp chưa có !",0,3082
sử dụng slide nguyên bản tiếng anh .,0,3083
thầy giảng rất kỹ từng bài tập .,2,3084
thầy hay chảy mồ hôi nhìn có cảm giác nóng nực dễ sợ luôn .,0,3085
"cô rất tận tình , quan tâm đến sinh viên .",2,3086
giảng viên phải đảm bảo giờ lên lớp .,0,3087
giảng viên vui vẻ hòa đồng .,2,3088
"cách dạy của thầy như cưỡi ngựa xem hoa , 15 phút giảng xong một bài .",0,3089
thầy dạy khó hiểu .,0,3090
"có thể vận dụng được các kiến thức đã học để thiết kế , chế tạo , tính toán .",2,3091
cô rất hòa đồng và nhiệt huyết với học sinh .,2,3092
thầy không thông báo rõ cho sinh viên về nội dung làm chiếm bao nhiêu .,0,3093
giảng bài tập nhiệt tình .,2,3094
giáo viên bám sát kiến thức .,2,3095
"thầy dạy hay và bài tập hay nâng cao kỹ năng lập trình cho sinh viên , bổ sung kiến thức cần thiết .",2,3096
"nhiệt tình , truyền đạt tốt , hướng dẫn tận tình .",2,3097
"giọng điệu khi nói hơi nhanh khó nghe , khả năng truyền đạt chưa tốt .",0,3098
nhiệt huyết .,2,3099
bài tập thực hành thường đi trước nội dung lý thuyết được học .,0,3100
tuy nhiên môn học được giảng bằng tiếng anh nên em cũng không nắm được hết nội dung thầy giảng .,0,3101
cảm ơn thầy đã sửa lỗi khi cài vmware giúp em colonsmallsmile .,1,3102
"tận tâm , dễ hiểu , nhiệt tình .",2,3103
cũng hài lòng .,1,3104
cách làm bài của thầy dễ hiểu rõ ràng .,2,3105
"thầy dạy rất nhiệt tình , thầy kiêm luôn giáo viên thực hành .",2,3106
"dạy buồn ngủ , khó hiểu .",0,3107
thầy dạy rất vui và hiệu quả !,2,3108
"phương pháp dạy hay , tân tâm , nhiệt tình .",2,3109
"thầy nhiệt tình và dễ thương , giúp em tìm tòi và hiểu những cái không có trong sách , nhờ thầy ôn tập mà em đã có đủ kiến thức để làm bài thi và có kiến thức căn bản sau này .",2,3110
"thầy dạy nhiệt tình , nhiều bài tập , dễ hiểu .",2,3111
"cô giảng rất tuyệt , cô rất nhiệt tình hướng dẫn tất cả các bạn trong lớp , vui tính .",2,3112
cho những bài tập bổ ích giúp sinh viên nắm rõ được kiến thức của môn học .,2,3113
quan tâm giúp đỡ và luôn nhiệt tình khi học sinh hỏi bài .,2,3114
dạy khá chuyên cần .,2,3115
cô giao bài tập nhiệt tình .,2,3116
"giáo viên dạy rất hay , tạo niềm vui cho sinh viên .",2,3117
"thầy vui tính , dạy dễ hiểu .",2,3118
"chất giọng của cô đều đều dễ gây buồn ngủ , slide bài giảng chưa logic .",0,3119
cần thông báo rõ hình thức đánh giá môn học một cách thống nhất .,0,3120
"khuyên răn sinh viên , đặt vấn đề tốt cho một giải pháp .",2,3121
cách truyền đạt của giảng viên chưa tốt .,0,3122
giáo viên tận tình chỉ bảo .,2,3123
giờ giấc không đảm bảo .,0,3124
đôi chỗ vẫn khó hiểu .,0,3125
giảng dạy đúng giờ và nhiệt tình .,2,3126
"giảng viên nhiệt tình , tận tâm , bài giảng thu hút , dễ hiểu .",2,3127
hiện nay trong phòng lab số lượng kit học bị hư hỏng nhiều .,0,3128
"giảng dạy hiệu quả , tích cực trong tiết học .",2,3129
"dạy hay , nhiệt tình .",2,3130
giảng viên có tâm huyết .,2,3131
"giảng viên tận tâm , nhiệt tình hỗ trợ sinh viên học tập , làm đồ án .",2,3132
nhiều khi không hiểu thầy đang nói cái gì colondoublesurprise .,0,3133
trang bị thêm nhiều thiết bị mạng hơn nữa để thực hành !,0,3134
quá theo sách .,0,3135
cô dạy dễ hiểu và vui quá trời .,2,3136
trong quá trình giảng dạy giảng viên luôn nhiệt tình với sinh viên .,2,3137
"giảng viên thường cho nghỉ không lý do , cả lớp lên ngồi đợi rất lâu rồi có người lên thay giáo viên báo nghỉ hoặc thường xuyên đi trễ trên 30 phút với lý do "" kẹt xe "" .",0,3138
số lượng bài tập chưa nhiều .,0,3139
truyền đạt bài dễ tiếp thu .,2,3140
dạy hay dot giúp học sinh tiếp thu .,2,3141
"thưa , những tài liệu thầy đưa ra đủ để em có thể tự hoàn thành đồ án riêng mình .",0,3142
buổi nào cũng đều dài quá mức cần thiết gây mệt mỏi .,0,3143
giáo viên dạy nhiệt tình và hài hước .,2,3144
khi cô dạy luôn cuốn hút sinh viên .,2,3145
"giảng viên cho nhiều ví dụ , bài tập minh họa cho sinh viên .",2,3146
"cách trình bày bài giảng của thầy rất hay , dễ hiểu và dễ tiếp thu đối với sinh viên .",2,3147
khả năng truyền đạt chưa ổn .,0,3148
thầy dạy rất nhiệt tình và tận tâm .,2,3149
giáo viên lên lớp đúng giờ và phát âm khá chuẩn .,2,3150
vui vẻ hòa đồng .,2,3151
"thời gian thực hành tập trung chưa phù hợp , bị trùng với các giờ với các môn học khác .",0,3152
nội dung kiến thức được đảm bảo .,2,3153
"dụng cụ học tập còn thiếu , không đảm bảo cho sinh viên tập luyện .",0,3154
"sửa lại một số máy bị hư chuột , chuột rất khó di chuyển , gây khó khăn cho việc thực hành .",0,3155
đề khó colonbigsmile .,0,3156
về chuyên môn thì khỏi chê vào đâu cả .,2,3157
thầy dạy còn chưa rõ .,0,3158
cô nhiệt tình giảng dạy .,2,3159
mong thầy dạy đúng số tiết mà môn đó quy định .,0,3160
thầy nhiệt tâm và rất cởi mở .,2,3161
thầy không cho lớp ôn tập nội dung thi ở kỳ kiểm tra giữa kỳ và cả thi cuối kỳ .,0,3162
tài liệu giảng dạy cần bổ sung .,0,3163
tuy nhiên truyền đạt hơi khó hiểu cho sinh viên .,0,3164
hình thức thực hiện chưa chuyên nghiệp và máy móc .,0,3165
cần cho bài tập sau mỗi ngày học .,0,3166
có nhiều cái mới khi học môn của thầy .,1,3167
visual studio của các máy trong phòng máy đã hết hạn .,0,3168
cô giảng với giọng quá nhỏ chả nghe gì cả .,0,3169
cung cấp tài liệu tham khảo tốt .,2,3170
không hợp với cách giảng dạy .,0,3171
cần tìm ra những phương pháp giảng dạy tốt hơn để sinh viên chúng em hiểu bài và nhớ lâu hơn .,0,3172
"giảng viên nhiệt tình hướng dẫn học , giải các bài tập khó .",2,3173
"không khí lớp thoải mái , tạo động lực phát biểu , góp ý kiển .",2,3174
khá tốt .,2,3175
"giáo viên giảng nhanh quá , em chép bài không kịp và không kịp hiểu .",0,3176
"thầy rất dễ thương , vui vẻ .",2,3177
máy chiếu phòng học rất rất rất tệ !,0,3178
"thầy không đảm bảo lên lớp đúng giờ , có bữa nghỉ mà cũng không báo trước cho sinh viên hay thông báo nghỉ .",0,3179
em rất thích cách dạy và tận tình giúp đỡ từng sinh viên của thầy .,2,3180
"thầy có phương pháp chấm bài hay , tuy khó nhưng rất bổ ích cho sinh viên .",2,3181
mặc dù thầy rất nhiệt tình nhưng lượng kiến thức thầy truyền đạt chúng em không tiếp thu được một cách hiệu quả .,0,3182
chưa hài lòng .,0,3183
thầy tận tâm vì sinh viên .,2,3184
"thầy dạy kỹ , tận tâm với sinh viên , thường xuyên trao đổi với sinh viên ngoài giờ .",2,3185
điều này gây lên sự chênh lệch rõ rệt về trình độ anh văn trong lớp .,0,3186
cô dạy còn hơi nhanh hơi thuần lý thuyết .,0,3187
"cho nhiều bài tập nhưng không giải , sinh viên chỉ biết làm mà không biết mình làm đúng hay không .",0,3188
"giờ lên lớp thời gian đầu là dành cho seminar , 30 - 45 phút còn lại sau khi seminar giảng viên lại cho làm bài tập thực hành , sinh viên tự làm , giảng viên không hướng dẫn gì thêm và làm việc riêng .",0,3189
nếu được thì em nghĩ thầy nên có bài sửa sau mỗi ngày deadline thực hành vì môn mạng máy tính rất khó nắm bắt .,0,3190
cô truyền đạt bài giảng rất tốt .,2,3191
"cô dạy rất hay , cho bài tập ứng dụng nhiều vào thực tiễn .",2,3192
"giảng dễ hiểu và vui tính , thân thiện .",2,3193
nội dung truyền đạt của thầy không chỉ về kiến thức mà còn về cách sống .,2,3194
giảng viên thường xuyên nghỉ không báo trước .,0,3195
"giảng viên có tâm huyết , khả năng truyền đạt đến học sinh cao .",2,3196
"thầy dạy dễ hiểu , rất nhiệt tình trả lời giải đáp của sinh viên .",2,3197
giảng viên tích cực giải đề các năm .,2,3198
"trong khi cô giảng bài thì lớp còn ồn nên khó để tập trung nghe giảng , mong cô dùng micro để giảng bài và nói to hơn ạ .",0,3199
"giáo viên tận tâm , giải đáp những thắc mắc của học sinh , cực kỳ linh động .",2,3200
ngôn từ trong phương pháp giảng dạy gần gũi với sinh viên .,2,3201
lan man và hơi khó hiểu .,0,3202
thầy rất nhiệt tình và dạy dễ hiểu .,2,3203
may mắn cho các sinh viên sau này không còn làm việc với giảng viên này .,0,3204
"cô wzjwz226 rất tâm huyết với sinh viên , tận tâm , giảng bài có hiệu quả .",2,3205
"cô rất dễ thương , dạy dễ hiểu .",2,3206
phòng thực hành về mạng cần có nhiều trang thiết bị về mạng hơn để sinh viên có thể thực hành trên máy móc chứ không phải học thông qua các phần mềm .,0,3207
cần cho sinh viên làm hoạt động nhóm nhiều hơn và mở rộng nâng cao kiến thức cho sinh viên nhiều hơn nữa .,0,3208
"thầy nhiệt tình , tận tụy , vui vẻ .",2,3209
"thầy rất nghiêm khắc , là một người thầy rất giỏi .",2,3210
"do học chung với các anh chị khoá 2011 , một phần nhỏ là khoá 2012 , các anh chị quá ồn ào , ồn ào không chịu nổi mặc dù đã nhắc nhở nhiều lần .",0,3211
"lý do doubledot vào 2 tuần cuối kỳ , sinh viên phải làm đồ án rất nhiều môn , phải ôn thi .",0,3212
"thầy giảng rất nhiệt tình , cặn kẽ .",2,3213
giảng viên chưa truyền đạt tốt cho sinh viên và thái độ ban đầu chưa tốt .,0,3214
"cô dạy nhiệt tình , kiến thức sâu và rộng , liên hệ thực tiễn cụ thể .",2,3215
thầy cung cấp những thông tin rất mới và rất có ích cho sinh viên cả về học tập và làm việc sau này !,2,3216
em không có ý kiến gì cả .,1,3217
"giảng dạy tốt , nhiệt huyết với sinh viên .",2,3218
thầy cho nhiều bài tập .,1,3219
cô rất tận tình !,2,3220
cảm thấy rất may mắn khi được học thầy .,2,3221
thầy giảng dạy nhiệt tình và vui tính .,2,3222
"giảng viên quá nhiệt tình , hiểu sinh viên , thương sinh viên .",2,3223
"thầy vui tính , dạy dễ hiểu và tận tình .",2,3224
"giảng viên nghỉ dạy nhiều buổi , kiến thức truyền đạt cho sinh viên không nhiều .",0,3225
có đảm bảo chương trình dạy .,2,3226
nâng cao cơ sở vật chất giảng dạy .,0,3227
giảng viên nên có kỹ năng sư phạm tốt hơn .,0,3228
"cô rất tận tâm , nhiệt huyết , thân thiện , tạo không gian học rất thoải mái .",2,3229
"thiếu thông tin , tài liệu về môn học .",0,3230
chưa ôn tập được nhiều kiến thức cơ bản của anh văn 1 .,0,3231
học sinh yêu cầu giảng lại không giảng lại và bảo về tự xem lại .,0,3232
thầy dạy tận tâm .,2,3233
"cần giảng viên nói to rõ , làm cho tiết học thêm sôi động , hấp dẫn .",0,3234
"cô rất tuyệt , giảng lý thuyết và bài tập siêu kỹ , giải đáp thắc mắc của sinh viên cực nhanh vì chi tiết .",2,3235
"cô dạy vui vẻ nhiệt tình , giúp em có hứng học môn anh văn hơn .",2,3236
cô rất vui tính .,2,3237
"số lượng bài tập tại lớp mỗi buổi khá nhiều , em mong thầy có thể giảm bớt 2 - 3 bài .",0,3238
giáo viên giảng dạy kỹ từng phần .,2,3239
"cô cũng khuyến khích seminar để tăng khả năng sinh bày của sinh viên , trong quá trình trình bày hoặc xây dựng nội dung trình bày cô luôn tận tình giúp đỡ nếu có khó khăn từ phía sinh viên đó .",2,3240
đưa sinh viên đi tham quan thực tế về các doanh nghiệp .,2,3241
giao tiếp nhiều hơn .,0,3242
"khiến cho chúng em vừa đói lại vừa mệt , kiến thức thầy nói thật đáng để chúng em ghi nhận nhưng đói và mệt thì làm sao chúng em tiếp thu và thực hiện nổi .",0,3243
giải thích được rõ vấn đề .,2,3244
không có ý kiến gì !,1,3245
"thời lượng học lý thuyết của môn học ngắn , dễ bị ảnh hưởng khi giảng viên đến trễ hay tham gia các buổi họp .",0,3246
"giảng viên rất tôn trọng sinh viên , hướng dẫn tận tình cho sinh viên cách học và ôn tập cuối kỳ , ngoài ra còn hướng dẫn chi tiết cho sinh viên về đồ án tốt nghiệp .",2,3247
"không có sách dạy chi tiết về môn học nên học rất khó hiểu , cần có tài liều hướng dẫn cụ thể chi tiết , mong nhà trường viết thêm sách cho sinh viên .",0,3248
"nghỉ học nhiều , vào lớp trễ .",0,3249
hi vọng thầy có thể cải thiện kỹ năng truyền đạt hơn .,0,3250
sinh viên cần đi học chăm nghe thầy giảng và làm bài tập thầy cho .,2,3251
thầy chỉ dạy nhiệt tình những chỗ sinh viên chưa nắm rõ .,2,3252
ra bài tập vừa phải thôi và phải chữa bài .,0,3253
"dậy nhiệt tình , dễ tính .",2,3254
thầy có thể giới thiệu cho bọn em những cuốn sách có nội dung đầy đủ và phù hợp với nội dung của chương trình nhà trường đề ra .,0,3255
giảng viên khả năng truyền đạt tốt .,2,3256
"giáo viên giảng dạy nhiệt tình , tạo được hứng thú cho sinh viên .",2,3257
giảng viên không đưa các bài giảng lên hệ thống courses .,0,3258
thầy dạy hơi gây buồn ngủ .,0,3259
"thiếu trang bị , dụng cụ thực hành cần thiết , không đáp ứng đủ thời gian giảng dạy do vắng tiết .",0,3260
"cô tận tình , nhiệt tình trong công việc .",2,3261
thực hành không liên quan gì đến lý thuyết .,0,3262
giảng viên nói quá nhanh .,0,3263
đề nghị giảng viên sử dụng hiệu quả hơn kênh moodle để nâng cao chất lượng giảng dạy .,0,3264
khả năng truyền đạt của giảng viên chưa được tốt .,0,3265
thầy rất dễ chịu .,2,3266
"thầy nên vui vẻ giải đáp thắc mắc khi học sinh hỏi , bớt càu nhàu .",0,3267
"cung cấp cho sinh viên biết được mục đích và công dụng thực tiễn của môn học vào thực tế nghề nghiệp , thêm các ví dụ liên quan tới cách áp dụng môn học vào nghề nghiệp tương lai chứ không dừng ở việc lấy ví dụ cho bài giảng .",2,3268
tuy nhiên ai hỏi thì cô trả lời nhiệt tình .,2,3269
"giải chi tiết các bài tập , tiếp thu bài rất nhanh trong giờ giảng của thầy .",2,3270
cố gắng tạo mọi điều kiện để sinh viên hoạt động nâng cao kỹ năng .,2,3271
"cô dạy hơi khó hiểu , phức tạp hóa vấn đề .",0,3272
"cần đưa ra nhìu ví dụ , bài tập cộng bài giảng đi theo .",0,3273
thầy dạy tận tình .,2,3274
"câu văn trong bài giảng khó hiểu , không diễn đạt rõ ràng ý nghĩa .",0,3275
"bản thân thầy dạy thực hành mà 3 tuần học liền tương đương 1dot5 tháng mà thầy vẫn không làm được yêu cầu cơ bản của môn học , đó là kết nối oracle trên 2 máy .",0,3276
"thầy giảng hơi khó hiểu , thầy cần chủ động mở nhiều cuộc tranh luận với sinh viên .",0,3277
giảng hơi nhanh .,0,3278
"giáo viên tận tâm , công minh .",2,3279
"những đề bài tập của thầy rất hay , rất ấn tượng !",2,3280
làm thầy thì có tâm chút đi ạ .,0,3281
"có những ví dụ sinh động , dễ hiểu .",2,3282
giảng viên có nhiều kinh nghiệm chuyên môn .,2,3283
người thậy nhiệt huyết dù học sinh không đi học đầy đủ .,2,3284
cô không cung cấp đáp án bài tập trên moodle .,0,3285
"cách giảng đôi lúc ( vài buổi ) còn gây buồn ngủ , chưa thu hút ( có thể là do bài giảng nhiều lý thuyết mới ) .",0,3286
giảng viên có chuyên môn cao .,2,3287
"giảng viên đảm bảo thời gian lên lớp tốt , chấm điểm công bằng .",2,3288
"đây là một thực hành và là một môn khó , có số tín chỉ bằng 2 lý thuyết nên giảng viên cần giảng một cách khái quát về bài học trước để sinh viên về nhà có thể tự thực hành , chứ chiếu đề lên và bắt sinh viên làm thì bị trống kiến thức .",0,3289
giảng và giải bài quá nhanh .,0,3290
giảng dạy tận tình .,2,3291
slide chưa đẹp lắm .,0,3292
"chưa có nhiều trao đổi , tương tác với sinh viên trên các diễn đàn .",0,3293
"các bài tập , ví dụ cần đi liền với thực tiễn công việc sau này chứ không phải là các ví dụ như doubledot viết chương trình số phức , số thực , vẽ tam giác .",0,3294
"thiếu các thiết bị chạy hệ điều hành windows phone , ios , android cho sinh viên thực hành .",0,3295
"phương pháp giảng dạy tiên tiến , giờ học vui .",2,3296
cô sửa bài theo nhiều cách .,2,3297
nhiều khi thầy nghỉ không báo trước colonsad .,0,3298
